_id,ngay,giai,so,basocuoi,haisocuoi,chanle,createdAt,updatedAt,__v,date_obj
69189ab2deab5375d296c52a,22/07/2022,G3e,33274,274,74,CLC,2025-11-15 15:22:26.789,2025-11-15 15:22:26.789,0,2022-07-22
69189ab2deab5375d296c512,22/07/2022,ĐB,04093,093,93,CLL,2025-11-15 15:22:26.210,2025-11-15 15:22:26.210,0,2022-07-22
69189ab2deab5375d296c515,22/07/2022,G1,51457,457,57,CLL,2025-11-15 15:22:26.282,2025-11-15 15:22:26.282,0,2022-07-22
69189ab2deab5375d296c518,22/07/2022,G2a,29485,485,85,CCL,2025-11-15 15:22:26.354,2025-11-15 15:22:26.354,0,2022-07-22
69189ab2deab5375d296c51b,22/07/2022,G2b,11161,161,61,LCL,2025-11-15 15:22:26.426,2025-11-15 15:22:26.426,0,2022-07-22
69189ab2deab5375d296c51e,22/07/2022,G3a,79626,626,26,CCC,2025-11-15 15:22:26.497,2025-11-15 15:22:26.497,0,2022-07-22
69189ab2deab5375d296c521,22/07/2022,G3b,58052,052,52,CLC,2025-11-15 15:22:26.568,2025-11-15 15:22:26.568,0,2022-07-22
69189ab2deab5375d296c524,22/07/2022,G3c,46399,399,99,LLL,2025-11-15 15:22:26.640,2025-11-15 15:22:26.640,0,2022-07-22
69189ab2deab5375d296c527,22/07/2022,G3d,46795,795,95,LLL,2025-11-15 15:22:26.718,2025-11-15 15:22:26.718,0,2022-07-22
69189ab2deab5375d296c52d,22/07/2022,G3f,08210,210,10,CLC,2025-11-15 15:22:26.861,2025-11-15 15:22:26.861,0,2022-07-22
69189ab2deab5375d296c530,22/07/2022,G4a,2990,990,90,LLC,2025-11-15 15:22:26.932,2025-11-15 15:22:26.932,0,2022-07-22
69189ab3deab5375d296c533,22/07/2022,G4b,7622,622,22,CCC,2025-11-15 15:22:27.003,2025-11-15 15:22:27.003,0,2022-07-22
69189ab3deab5375d296c539,22/07/2022,G4d,0513,513,13,LLL,2025-11-15 15:22:27.148,2025-11-15 15:22:27.148,0,2022-07-22
69189ab3deab5375d296c536,22/07/2022,G4c,1306,306,06,LCC,2025-11-15 15:22:27.077,2025-11-15 15:22:27.077,0,2022-07-22
69189ab3deab5375d296c53f,22/07/2022,G5b,0986,986,86,LCC,2025-11-15 15:22:27.300,2025-11-15 15:22:27.300,0,2022-07-22
69189ab4deab5375d296c560,22/07/2022,G7d,00,00,00,,2025-11-15 15:22:28.112,2025-11-15 15:22:28.112,0,2022-07-22
69189ab4deab5375d296c55d,22/07/2022,G7c,84,84,84,,2025-11-15 15:22:28.041,2025-11-15 15:22:28.041,0,2022-07-22
69189ab3deab5375d296c55a,22/07/2022,G7b,32,32,32,,2025-11-15 15:22:27.970,2025-11-15 15:22:27.970,0,2022-07-22
69189ab3deab5375d296c557,22/07/2022,G7a,14,14,14,,2025-11-15 15:22:27.900,2025-11-15 15:22:27.900,0,2022-07-22
69189ab3deab5375d296c554,22/07/2022,G6c,140,140,40,LCC,2025-11-15 15:22:27.828,2025-11-15 15:22:27.828,0,2022-07-22
69189ab3deab5375d296c53c,22/07/2022,G5a,4595,595,95,LLL,2025-11-15 15:22:27.224,2025-11-15 15:22:27.224,0,2022-07-22
69189ab3deab5375d296c551,22/07/2022,G6b,697,697,97,CLL,2025-11-15 15:22:27.757,2025-11-15 15:22:27.757,0,2022-07-22
69189ab3deab5375d296c54b,22/07/2022,G5f,4489,489,89,CCL,2025-11-15 15:22:27.608,2025-11-15 15:22:27.608,0,2022-07-22
69189ab3deab5375d296c548,22/07/2022,G5e,6407,407,07,CCL,2025-11-15 15:22:27.536,2025-11-15 15:22:27.536,0,2022-07-22
69189ab3deab5375d296c545,22/07/2022,G5d,6982,982,82,LCC,2025-11-15 15:22:27.464,2025-11-15 15:22:27.464,0,2022-07-22
69189ab3deab5375d296c542,22/07/2022,G5c,6083,083,83,CCL,2025-11-15 15:22:27.387,2025-11-15 15:22:27.387,0,2022-07-22
69189ab3deab5375d296c54e,22/07/2022,G6a,826,826,26,CCC,2025-11-15 15:22:27.686,2025-11-15 15:22:27.686,0,2022-07-22
69189ab0deab5375d296c4d9,23/07/2022,G3e,86896,896,96,CLC,2025-11-15 15:22:24.851,2025-11-15 15:22:24.851,0,2022-07-23
69189ab0deab5375d296c4d6,23/07/2022,G3d,61505,505,05,LCL,2025-11-15 15:22:24.779,2025-11-15 15:22:24.779,0,2022-07-23
69189ab0deab5375d296c4d0,23/07/2022,G3b,93938,938,38,LLC,2025-11-15 15:22:24.636,2025-11-15 15:22:24.636,0,2022-07-23
69189ab0deab5375d296c4d3,23/07/2022,G3c,52555,555,55,LLL,2025-11-15 15:22:24.708,2025-11-15 15:22:24.708,0,2022-07-23
69189ab0deab5375d296c4cd,23/07/2022,G3a,41322,322,22,LCC,2025-11-15 15:22:24.566,2025-11-15 15:22:24.566,0,2022-07-23
69189ab2deab5375d296c50f,23/07/2022,G7d,51,51,51,,2025-11-15 15:22:26.139,2025-11-15 15:22:26.139,0,2022-07-23
69189ab0deab5375d296c4c7,23/07/2022,G2a,28048,048,48,CCC,2025-11-15 15:22:24.424,2025-11-15 15:22:24.424,0,2022-07-23
69189ab0deab5375d296c4c4,23/07/2022,G1,86993,993,93,LLL,2025-11-15 15:22:24.353,2025-11-15 15:22:24.353,0,2022-07-23
69189ab0deab5375d296c4c1,23/07/2022,ĐB,15361,361,61,LCL,2025-11-15 15:22:24.282,2025-11-15 15:22:24.282,0,2022-07-23
69189ab2deab5375d296c50c,23/07/2022,G7c,61,61,61,,2025-11-15 15:22:26.068,2025-11-15 15:22:26.068,0,2022-07-23
69189ab0deab5375d296c4dc,23/07/2022,G3f,02053,053,53,CLL,2025-11-15 15:22:24.922,2025-11-15 15:22:24.922,0,2022-07-23
69189ab0deab5375d296c4ca,23/07/2022,G2b,57745,745,45,LCL,2025-11-15 15:22:24.495,2025-11-15 15:22:24.495,0,2022-07-23
69189ab0deab5375d296c4df,23/07/2022,G4a,4842,842,42,CCC,2025-11-15 15:22:24.993,2025-11-15 15:22:24.993,0,2022-07-23
69189ab1deab5375d296c4fa,23/07/2022,G5f,7072,072,72,CLC,2025-11-15 15:22:25.635,2025-11-15 15:22:25.635,0,2022-07-23
69189ab1deab5375d296c4e5,23/07/2022,G4c,3931,931,31,LLL,2025-11-15 15:22:25.136,2025-11-15 15:22:25.136,0,2022-07-23
69189ab1deab5375d296c4e2,23/07/2022,G4b,5846,846,46,CCC,2025-11-15 15:22:25.064,2025-11-15 15:22:25.064,0,2022-07-23
69189ab1deab5375d296c506,23/07/2022,G7a,53,53,53,,2025-11-15 15:22:25.921,2025-11-15 15:22:25.921,0,2022-07-23
69189ab1deab5375d296c503,23/07/2022,G6c,154,154,54,LLC,2025-11-15 15:22:25.849,2025-11-15 15:22:25.849,0,2022-07-23
69189ab1deab5375d296c500,23/07/2022,G6b,573,573,73,LLL,2025-11-15 15:22:25.778,2025-11-15 15:22:25.778,0,2022-07-23
69189ab1deab5375d296c4fd,23/07/2022,G6a,000,000,00,CCC,2025-11-15 15:22:25.707,2025-11-15 15:22:25.707,0,2022-07-23
69189ab1deab5375d296c509,23/07/2022,G7b,87,87,87,,2025-11-15 15:22:25.992,2025-11-15 15:22:25.992,0,2022-07-23
69189ab1deab5375d296c4f4,23/07/2022,G5d,5103,103,03,LCL,2025-11-15 15:22:25.493,2025-11-15 15:22:25.493,0,2022-07-23
69189ab1deab5375d296c4f1,23/07/2022,G5c,0727,727,27,LCL,2025-11-15 15:22:25.422,2025-11-15 15:22:25.422,0,2022-07-23
69189ab1deab5375d296c4ee,23/07/2022,G5b,5850,850,50,CLC,2025-11-15 15:22:25.350,2025-11-15 15:22:25.350,0,2022-07-23
69189ab1deab5375d296c4eb,23/07/2022,G5a,2370,370,70,LLC,2025-11-15 15:22:25.278,2025-11-15 15:22:25.278,0,2022-07-23
69189ab1deab5375d296c4e8,23/07/2022,G4d,4697,697,97,CLL,2025-11-15 15:22:25.207,2025-11-15 15:22:25.207,0,2022-07-23
69189ab1deab5375d296c4f7,23/07/2022,G5e,4180,180,80,LCC,2025-11-15 15:22:25.564,2025-11-15 15:22:25.564,0,2022-07-23
69189aafdeab5375d296c48e,24/07/2022,G4a,8872,872,72,CLC,2025-11-15 15:22:23.067,2025-11-15 15:22:23.067,0,2022-07-24
69189aaedeab5375d296c48b,24/07/2022,G3f,33105,105,05,LCL,2025-11-15 15:22:22.996,2025-11-15 15:22:22.996,0,2022-07-24
69189aaedeab5375d296c488,24/07/2022,G3e,33795,795,95,LLL,2025-11-15 15:22:22.922,2025-11-15 15:22:22.922,0,2022-07-24
69189aaedeab5375d296c485,24/07/2022,G3d,66458,458,58,CLC,2025-11-15 15:22:22.851,2025-11-15 15:22:22.851,0,2022-07-24
69189aaedeab5375d296c482,24/07/2022,G3c,39036,036,36,CLC,2025-11-15 15:22:22.774,2025-11-15 15:22:22.774,0,2022-07-24
69189aaedeab5375d296c476,24/07/2022,G2a,77335,335,35,LLL,2025-11-15 15:22:22.450,2025-11-15 15:22:22.450,0,2022-07-24
69189aaedeab5375d296c47c,24/07/2022,G3a,18856,856,56,CLC,2025-11-15 15:22:22.599,2025-11-15 15:22:22.599,0,2022-07-24
69189aaedeab5375d296c479,24/07/2022,G2b,30735,735,35,LLL,2025-11-15 15:22:22.521,2025-11-15 15:22:22.521,0,2022-07-24
69189aaedeab5375d296c473,24/07/2022,G1,51386,386,86,LCC,2025-11-15 15:22:22.379,2025-11-15 15:22:22.379,0,2022-07-24
69189aaedeab5375d296c470,24/07/2022,ĐB,22857,857,57,CLL,2025-11-15 15:22:22.308,2025-11-15 15:22:22.308,0,2022-07-24
69189aaedeab5375d296c47f,24/07/2022,G3b,99500,500,00,LCC,2025-11-15 15:22:22.703,2025-11-15 15:22:22.703,0,2022-07-24
69189aafdeab5375d296c491,24/07/2022,G4b,2380,380,80,LCC,2025-11-15 15:22:23.138,2025-11-15 15:22:23.138,0,2022-07-24
69189aafdeab5375d296c4a9,24/07/2022,G5f,8796,796,96,LLC,2025-11-15 15:22:23.708,2025-11-15 15:22:23.708,0,2022-07-24
69189aafdeab5375d296c497,24/07/2022,G4d,9457,457,57,CLL,2025-11-15 15:22:23.280,2025-11-15 15:22:23.280,0,2022-07-24
69189ab0deab5375d296c4b8,24/07/2022,G7b,64,64,64,,2025-11-15 15:22:24.068,2025-11-15 15:22:24.068,0,2022-07-24
69189aafdeab5375d296c4b5,24/07/2022,G7a,00,00,00,,2025-11-15 15:22:23.996,2025-11-15 15:22:23.996,0,2022-07-24
69189aafdeab5375d296c4b2,24/07/2022,G6c,632,632,32,CLC,2025-11-15 15:22:23.922,2025-11-15 15:22:23.922,0,2022-07-24
69189aafdeab5375d296c4af,24/07/2022,G6b,933,933,33,LLL,2025-11-15 15:22:23.851,2025-11-15 15:22:23.851,0,2022-07-24
69189aafdeab5375d296c4ac,24/07/2022,G6a,915,915,15,LLL,2025-11-15 15:22:23.780,2025-11-15 15:22:23.780,0,2022-07-24
69189ab0deab5375d296c4bb,24/07/2022,G7c,28,28,28,,2025-11-15 15:22:24.139,2025-11-15 15:22:24.139,0,2022-07-24
69189aafdeab5375d296c4a6,24/07/2022,G5e,0787,787,87,LCL,2025-11-15 15:22:23.637,2025-11-15 15:22:23.637,0,2022-07-24
69189ab0deab5375d296c4be,24/07/2022,G7d,01,01,01,,2025-11-15 15:22:24.210,2025-11-15 15:22:24.210,0,2022-07-24
69189aafdeab5375d296c49a,24/07/2022,G5a,9494,494,94,CLC,2025-11-15 15:22:23.352,2025-11-15 15:22:23.352,0,2022-07-24
69189aafdeab5375d296c494,24/07/2022,G4c,7349,349,49,LCL,2025-11-15 15:22:23.209,2025-11-15 15:22:23.209,0,2022-07-24
69189aafdeab5375d296c4a0,24/07/2022,G5c,6282,282,82,CCC,2025-11-15 15:22:23.495,2025-11-15 15:22:23.495,0,2022-07-24
69189aafdeab5375d296c4a3,24/07/2022,G5d,6285,285,85,CCL,2025-11-15 15:22:23.566,2025-11-15 15:22:23.566,0,2022-07-24
69189aafdeab5375d296c49d,24/07/2022,G5b,0203,203,03,CCL,2025-11-15 15:22:23.423,2025-11-15 15:22:23.423,0,2022-07-24
69189aaddeab5375d296c440,25/07/2022,G4b,6840,840,40,CCC,2025-11-15 15:22:21.165,2025-11-15 15:22:21.165,0,2022-07-25
69189aacdeab5375d296c41f,25/07/2022,ĐB,69502,502,02,LCC,2025-11-15 15:22:20.368,2025-11-15 15:22:20.368,0,2022-07-25
69189aacdeab5375d296c422,25/07/2022,G1,72642,642,42,CCC,2025-11-15 15:22:20.440,2025-11-15 15:22:20.440,0,2022-07-25
69189aacdeab5375d296c425,25/07/2022,G2a,04474,474,74,CLC,2025-11-15 15:22:20.519,2025-11-15 15:22:20.519,0,2022-07-25
69189aacdeab5375d296c42b,25/07/2022,G3a,99464,464,64,CCC,2025-11-15 15:22:20.662,2025-11-15 15:22:20.662,0,2022-07-25
69189aacdeab5375d296c42e,25/07/2022,G3b,91324,324,24,LCC,2025-11-15 15:22:20.734,2025-11-15 15:22:20.734,0,2022-07-25
69189aacdeab5375d296c431,25/07/2022,G3c,13169,169,69,LCL,2025-11-15 15:22:20.806,2025-11-15 15:22:20.806,0,2022-07-25
69189aacdeab5375d296c434,25/07/2022,G3d,61240,240,40,CCC,2025-11-15 15:22:20.877,2025-11-15 15:22:20.877,0,2022-07-25
69189aacdeab5375d296c437,25/07/2022,G3e,37704,704,04,LCC,2025-11-15 15:22:20.948,2025-11-15 15:22:20.948,0,2022-07-25
69189aaddeab5375d296c43a,25/07/2022,G3f,66460,460,60,CCC,2025-11-15 15:22:21.022,2025-11-15 15:22:21.022,0,2022-07-25
69189aaddeab5375d296c43d,25/07/2022,G4a,1056,056,56,CLC,2025-11-15 15:22:21.094,2025-11-15 15:22:21.094,0,2022-07-25
69189aacdeab5375d296c428,25/07/2022,G2b,23788,788,88,LCC,2025-11-15 15:22:20.591,2025-11-15 15:22:20.591,0,2022-07-25
69189aaddeab5375d296c443,25/07/2022,G4c,0293,293,93,CLL,2025-11-15 15:22:21.236,2025-11-15 15:22:21.236,0,2022-07-25
69189aaddeab5375d296c449,25/07/2022,G5a,3061,061,61,CCL,2025-11-15 15:22:21.378,2025-11-15 15:22:21.378,0,2022-07-25
69189aaddeab5375d296c446,25/07/2022,G4d,3918,918,18,LLC,2025-11-15 15:22:21.307,2025-11-15 15:22:21.307,0,2022-07-25
69189aaedeab5375d296c46a,25/07/2022,G7c,02,02,02,,2025-11-15 15:22:22.165,2025-11-15 15:22:22.165,0,2022-07-25
69189aaedeab5375d296c467,25/07/2022,G7b,60,60,60,,2025-11-15 15:22:22.094,2025-11-15 15:22:22.094,0,2022-07-25
69189aaedeab5375d296c464,25/07/2022,G7a,18,18,18,,2025-11-15 15:22:22.022,2025-11-15 15:22:22.022,0,2022-07-25
69189aaddeab5375d296c461,25/07/2022,G6c,737,737,37,LLL,2025-11-15 15:22:21.951,2025-11-15 15:22:21.951,0,2022-07-25
69189aaddeab5375d296c45e,25/07/2022,G6b,637,637,37,CLL,2025-11-15 15:22:21.880,2025-11-15 15:22:21.880,0,2022-07-25
69189aaedeab5375d296c46d,25/07/2022,G7d,53,53,53,,2025-11-15 15:22:22.237,2025-11-15 15:22:22.237,0,2022-07-25
69189aaddeab5375d296c458,25/07/2022,G5f,9033,033,33,CLL,2025-11-15 15:22:21.737,2025-11-15 15:22:21.737,0,2022-07-25
69189aaddeab5375d296c455,25/07/2022,G5e,9816,816,16,CLC,2025-11-15 15:22:21.664,2025-11-15 15:22:21.664,0,2022-07-25
69189aaddeab5375d296c452,25/07/2022,G5d,4776,776,76,LLC,2025-11-15 15:22:21.592,2025-11-15 15:22:21.592,0,2022-07-25
69189aaddeab5375d296c44f,25/07/2022,G5c,5228,228,28,CCC,2025-11-15 15:22:21.521,2025-11-15 15:22:21.521,0,2022-07-25
69189aaddeab5375d296c44c,25/07/2022,G5b,5636,636,36,CLC,2025-11-15 15:22:21.450,2025-11-15 15:22:21.450,0,2022-07-25
69189aaddeab5375d296c45b,25/07/2022,G6a,755,755,55,LLL,2025-11-15 15:22:21.808,2025-11-15 15:22:21.808,0,2022-07-25
69189aabdeab5375d296c3ec,26/07/2022,G4a,2344,344,44,LCC,2025-11-15 15:22:19.157,2025-11-15 15:22:19.157,0,2022-07-26
69189aabdeab5375d296c3e9,26/07/2022,G3f,46439,439,39,CLL,2025-11-15 15:22:19.085,2025-11-15 15:22:19.085,0,2022-07-26
69189aabdeab5375d296c3e6,26/07/2022,G3e,63855,855,55,CLL,2025-11-15 15:22:19.010,2025-11-15 15:22:19.010,0,2022-07-26
69189aaadeab5375d296c3e3,26/07/2022,G3d,74791,791,91,LLL,2025-11-15 15:22:18.938,2025-11-15 15:22:18.938,0,2022-07-26
69189aaadeab5375d296c3e0,26/07/2022,G3c,68381,381,81,LCL,2025-11-15 15:22:18.867,2025-11-15 15:22:18.867,0,2022-07-26
69189aaadeab5375d296c3d4,26/07/2022,G2a,14877,877,77,CLL,2025-11-15 15:22:18.580,2025-11-15 15:22:18.580,0,2022-07-26
69189aaadeab5375d296c3d7,26/07/2022,G2b,72399,399,99,LLL,2025-11-15 15:22:18.652,2025-11-15 15:22:18.652,0,2022-07-26
69189aaadeab5375d296c3d1,26/07/2022,G1,96583,583,83,LCL,2025-11-15 15:22:18.509,2025-11-15 15:22:18.509,0,2022-07-26
69189aaadeab5375d296c3ce,26/07/2022,ĐB,00558,558,58,LLC,2025-11-15 15:22:18.438,2025-11-15 15:22:18.438,0,2022-07-26
69189aabdeab5375d296c3ef,26/07/2022,G4b,6667,667,67,CCL,2025-11-15 15:22:19.228,2025-11-15 15:22:19.228,0,2022-07-26
69189aaadeab5375d296c3da,26/07/2022,G3a,55785,785,85,LCL,2025-11-15 15:22:18.724,2025-11-15 15:22:18.724,0,2022-07-26
69189aabdeab5375d296c3f2,26/07/2022,G4c,0716,716,16,LLC,2025-11-15 15:22:19.299,2025-11-15 15:22:19.299,0,2022-07-26
69189aaadeab5375d296c3dd,26/07/2022,G3b,71653,653,53,CLL,2025-11-15 15:22:18.796,2025-11-15 15:22:18.796,0,2022-07-26
69189aabdeab5375d296c3f8,26/07/2022,G5a,5996,996,96,LLC,2025-11-15 15:22:19.442,2025-11-15 15:22:19.442,0,2022-07-26
69189aacdeab5375d296c419,26/07/2022,G7c,26,26,26,,2025-11-15 15:22:20.224,2025-11-15 15:22:20.224,0,2022-07-26
69189aacdeab5375d296c416,26/07/2022,G7b,35,35,35,,2025-11-15 15:22:20.153,2025-11-15 15:22:20.153,0,2022-07-26
69189aacdeab5375d296c413,26/07/2022,G7a,13,13,13,,2025-11-15 15:22:20.083,2025-11-15 15:22:20.083,0,2022-07-26
69189aacdeab5375d296c410,26/07/2022,G6c,802,802,02,CCC,2025-11-15 15:22:20.011,2025-11-15 15:22:20.011,0,2022-07-26
69189aabdeab5375d296c40d,26/07/2022,G6b,279,279,79,CLL,2025-11-15 15:22:19.940,2025-11-15 15:22:19.940,0,2022-07-26
69189aabdeab5375d296c40a,26/07/2022,G6a,217,217,17,CLL,2025-11-15 15:22:19.869,2025-11-15 15:22:19.869,0,2022-07-26
69189aabdeab5375d296c3f5,26/07/2022,G4d,5682,682,82,CCC,2025-11-15 15:22:19.371,2025-11-15 15:22:19.371,0,2022-07-26
69189aabdeab5375d296c407,26/07/2022,G5f,4113,113,13,LLL,2025-11-15 15:22:19.798,2025-11-15 15:22:19.798,0,2022-07-26
69189aabdeab5375d296c404,26/07/2022,G5e,1030,030,30,CLC,2025-11-15 15:22:19.727,2025-11-15 15:22:19.727,0,2022-07-26
69189aabdeab5375d296c401,26/07/2022,G5d,2698,698,98,CLC,2025-11-15 15:22:19.655,2025-11-15 15:22:19.655,0,2022-07-26
69189aabdeab5375d296c3fe,26/07/2022,G5c,0076,076,76,CLC,2025-11-15 15:22:19.584,2025-11-15 15:22:19.584,0,2022-07-26
69189aabdeab5375d296c3fb,26/07/2022,G5b,4337,337,37,LLL,2025-11-15 15:22:19.513,2025-11-15 15:22:19.513,0,2022-07-26
69189aacdeab5375d296c41c,26/07/2022,G7d,55,55,55,,2025-11-15 15:22:20.297,2025-11-15 15:22:20.297,0,2022-07-26
69189aa9deab5375d296c398,27/07/2022,G3f,91584,584,84,LCC,2025-11-15 15:22:17.151,2025-11-15 15:22:17.151,0,2022-07-27
69189aa9deab5375d296c395,27/07/2022,G3e,34038,038,38,CLC,2025-11-15 15:22:17.080,2025-11-15 15:22:17.080,0,2022-07-27
69189aa9deab5375d296c392,27/07/2022,G3d,14839,839,39,CLL,2025-11-15 15:22:17.008,2025-11-15 15:22:17.008,0,2022-07-27
69189aa8deab5375d296c38f,27/07/2022,G3c,83520,520,20,LCC,2025-11-15 15:22:16.936,2025-11-15 15:22:16.936,0,2022-07-27
69189aa8deab5375d296c38c,27/07/2022,G3b,69885,885,85,CCL,2025-11-15 15:22:16.864,2025-11-15 15:22:16.864,0,2022-07-27
69189aa8deab5375d296c383,27/07/2022,G2a,61771,771,71,LLL,2025-11-15 15:22:16.640,2025-11-15 15:22:16.640,0,2022-07-27
69189aa8deab5375d296c386,27/07/2022,G2b,47619,619,19,CLL,2025-11-15 15:22:16.712,2025-11-15 15:22:16.712,0,2022-07-27
69189aa8deab5375d296c380,27/07/2022,G1,63250,250,50,CLC,2025-11-15 15:22:16.568,2025-11-15 15:22:16.568,0,2022-07-27
69189aa8deab5375d296c37d,27/07/2022,ĐB,09155,155,55,LLL,2025-11-15 15:22:16.495,2025-11-15 15:22:16.495,0,2022-07-27
69189aa9deab5375d296c39b,27/07/2022,G4a,7099,099,99,CLL,2025-11-15 15:22:17.223,2025-11-15 15:22:17.223,0,2022-07-27
69189aa8deab5375d296c389,27/07/2022,G3a,30310,310,10,LLC,2025-11-15 15:22:16.793,2025-11-15 15:22:16.793,0,2022-07-27
69189aa9deab5375d296c39e,27/07/2022,G4b,8552,552,52,LLC,2025-11-15 15:22:17.294,2025-11-15 15:22:17.294,0,2022-07-27
69189aa9deab5375d296c3a1,27/07/2022,G4c,5600,600,00,CCC,2025-11-15 15:22:17.366,2025-11-15 15:22:17.366,0,2022-07-27
69189aa9deab5375d296c3a4,27/07/2022,G4d,5581,581,81,LCL,2025-11-15 15:22:17.437,2025-11-15 15:22:17.437,0,2022-07-27
69189aaadeab5375d296c3cb,27/07/2022,G7d,33,33,33,,2025-11-15 15:22:18.367,2025-11-15 15:22:18.367,0,2022-07-27
69189aaadeab5375d296c3c5,27/07/2022,G7b,15,15,15,,2025-11-15 15:22:18.219,2025-11-15 15:22:18.219,0,2022-07-27
69189aaadeab5375d296c3c2,27/07/2022,G7a,89,89,89,,2025-11-15 15:22:18.148,2025-11-15 15:22:18.148,0,2022-07-27
69189aaadeab5375d296c3bf,27/07/2022,G6c,820,820,20,CCC,2025-11-15 15:22:18.076,2025-11-15 15:22:18.076,0,2022-07-27
69189aaadeab5375d296c3bc,27/07/2022,G6b,752,752,52,LLC,2025-11-15 15:22:18.004,2025-11-15 15:22:18.004,0,2022-07-27
69189aa9deab5375d296c3b9,27/07/2022,G6a,712,712,12,LLC,2025-11-15 15:22:17.933,2025-11-15 15:22:17.933,0,2022-07-27
69189aaadeab5375d296c3c8,27/07/2022,G7c,41,41,41,,2025-11-15 15:22:18.291,2025-11-15 15:22:18.291,0,2022-07-27
69189aa9deab5375d296c3b3,27/07/2022,G5e,9842,842,42,CCC,2025-11-15 15:22:17.791,2025-11-15 15:22:17.791,0,2022-07-27
69189aa9deab5375d296c3b0,27/07/2022,G5d,7585,585,85,LCL,2025-11-15 15:22:17.721,2025-11-15 15:22:17.721,0,2022-07-27
69189aa9deab5375d296c3ad,27/07/2022,G5c,4090,090,90,CLC,2025-11-15 15:22:17.650,2025-11-15 15:22:17.650,0,2022-07-27
69189aa9deab5375d296c3aa,27/07/2022,G5b,1315,315,15,LLL,2025-11-15 15:22:17.578,2025-11-15 15:22:17.578,0,2022-07-27
69189aa9deab5375d296c3a7,27/07/2022,G5a,2215,215,15,CLL,2025-11-15 15:22:17.508,2025-11-15 15:22:17.508,0,2022-07-27
69189aa9deab5375d296c3b6,27/07/2022,G5f,0531,531,31,LLL,2025-11-15 15:22:17.862,2025-11-15 15:22:17.862,0,2022-07-27
69189aa7deab5375d296c347,28/07/2022,G3f,56960,960,60,LCC,2025-11-15 15:22:15.198,2025-11-15 15:22:15.198,0,2022-07-28
69189aa7deab5375d296c344,28/07/2022,G3e,86675,675,75,CLL,2025-11-15 15:22:15.126,2025-11-15 15:22:15.126,0,2022-07-28
69189aa7deab5375d296c341,28/07/2022,G3d,84140,140,40,LCC,2025-11-15 15:22:15.054,2025-11-15 15:22:15.054,0,2022-07-28
69189aa6deab5375d296c33e,28/07/2022,G3c,87625,625,25,CCL,2025-11-15 15:22:14.981,2025-11-15 15:22:14.981,0,2022-07-28
69189aa6deab5375d296c33b,28/07/2022,G3b,98701,701,01,LCL,2025-11-15 15:22:14.908,2025-11-15 15:22:14.908,0,2022-07-28
69189aa6deab5375d296c332,28/07/2022,G2a,98472,472,72,CLC,2025-11-15 15:22:14.692,2025-11-15 15:22:14.692,0,2022-07-28
69189aa6deab5375d296c335,28/07/2022,G2b,09449,449,49,CCL,2025-11-15 15:22:14.763,2025-11-15 15:22:14.763,0,2022-07-28
69189aa6deab5375d296c32f,28/07/2022,G1,61023,023,23,CCL,2025-11-15 15:22:14.619,2025-11-15 15:22:14.619,0,2022-07-28
69189aa6deab5375d296c32c,28/07/2022,ĐB,56590,590,90,LLC,2025-11-15 15:22:14.547,2025-11-15 15:22:14.547,0,2022-07-28
69189aa7deab5375d296c34a,28/07/2022,G4a,7664,664,64,CCC,2025-11-15 15:22:15.270,2025-11-15 15:22:15.270,0,2022-07-28
69189aa6deab5375d296c338,28/07/2022,G3a,04650,650,50,CLC,2025-11-15 15:22:14.836,2025-11-15 15:22:14.836,0,2022-07-28
69189aa7deab5375d296c34d,28/07/2022,G4b,1132,132,32,LLC,2025-11-15 15:22:15.342,2025-11-15 15:22:15.342,0,2022-07-28
69189aa8deab5375d296c37a,28/07/2022,G7d,15,15,15,,2025-11-15 15:22:16.424,2025-11-15 15:22:16.424,0,2022-07-28
69189aa7deab5375d296c353,28/07/2022,G4d,7758,758,58,LLC,2025-11-15 15:22:15.486,2025-11-15 15:22:15.486,0,2022-07-28
69189aa7deab5375d296c350,28/07/2022,G4c,0337,337,37,LLL,2025-11-15 15:22:15.414,2025-11-15 15:22:15.414,0,2022-07-28
69189aa8deab5375d296c374,28/07/2022,G7b,94,94,94,,2025-11-15 15:22:16.280,2025-11-15 15:22:16.280,0,2022-07-28
69189aa8deab5375d296c371,28/07/2022,G7a,10,10,10,,2025-11-15 15:22:16.209,2025-11-15 15:22:16.209,0,2022-07-28
69189aa8deab5375d296c36e,28/07/2022,G6c,034,034,34,CLC,2025-11-15 15:22:16.137,2025-11-15 15:22:16.137,0,2022-07-28
69189aa8deab5375d296c36b,28/07/2022,G6b,902,902,02,LCC,2025-11-15 15:22:16.065,2025-11-15 15:22:16.065,0,2022-07-28
69189aa7deab5375d296c368,28/07/2022,G6a,413,413,13,CLL,2025-11-15 15:22:15.993,2025-11-15 15:22:15.993,0,2022-07-28
69189aa8deab5375d296c377,28/07/2022,G7c,32,32,32,,2025-11-15 15:22:16.352,2025-11-15 15:22:16.352,0,2022-07-28
69189aa7deab5375d296c362,28/07/2022,G5e,5560,560,60,LCC,2025-11-15 15:22:15.848,2025-11-15 15:22:15.848,0,2022-07-28
69189aa7deab5375d296c35f,28/07/2022,G5d,1670,670,70,CLC,2025-11-15 15:22:15.776,2025-11-15 15:22:15.776,0,2022-07-28
69189aa7deab5375d296c35c,28/07/2022,G5c,3476,476,76,CLC,2025-11-15 15:22:15.703,2025-11-15 15:22:15.703,0,2022-07-28
69189aa7deab5375d296c359,28/07/2022,G5b,9054,054,54,CLC,2025-11-15 15:22:15.631,2025-11-15 15:22:15.631,0,2022-07-28
69189aa7deab5375d296c356,28/07/2022,G5a,7166,166,66,LCC,2025-11-15 15:22:15.558,2025-11-15 15:22:15.558,0,2022-07-28
69189aa7deab5375d296c365,28/07/2022,G5f,5790,790,90,LLC,2025-11-15 15:22:15.920,2025-11-15 15:22:15.920,0,2022-07-28
69189aa5deab5375d296c2f6,29/07/2022,G3f,17285,285,85,CCL,2025-11-15 15:22:13.264,2025-11-15 15:22:13.264,0,2022-07-29
69189aa5deab5375d296c2f3,29/07/2022,G3e,80769,769,69,LCL,2025-11-15 15:22:13.192,2025-11-15 15:22:13.192,0,2022-07-29
69189aa5deab5375d296c2f0,29/07/2022,G3d,95717,717,17,LLL,2025-11-15 15:22:13.122,2025-11-15 15:22:13.122,0,2022-07-29
69189aa5deab5375d296c2ed,29/07/2022,G3c,53358,358,58,LLC,2025-11-15 15:22:13.051,2025-11-15 15:22:13.051,0,2022-07-29
69189aa4deab5375d296c2ea,29/07/2022,G3b,06646,646,46,CCC,2025-11-15 15:22:12.980,2025-11-15 15:22:12.980,0,2022-07-29
69189aa4deab5375d296c2e1,29/07/2022,G2a,84138,138,38,LLC,2025-11-15 15:22:12.765,2025-11-15 15:22:12.765,0,2022-07-29
69189aa4deab5375d296c2e4,29/07/2022,G2b,43275,275,75,CLL,2025-11-15 15:22:12.836,2025-11-15 15:22:12.836,0,2022-07-29
69189aa4deab5375d296c2de,29/07/2022,G1,26296,296,96,CLC,2025-11-15 15:22:12.694,2025-11-15 15:22:12.694,0,2022-07-29
69189aa4deab5375d296c2db,29/07/2022,ĐB,92303,303,03,LCL,2025-11-15 15:22:12.622,2025-11-15 15:22:12.622,0,2022-07-29
69189aa5deab5375d296c2f9,29/07/2022,G4a,9639,639,39,CLL,2025-11-15 15:22:13.335,2025-11-15 15:22:13.335,0,2022-07-29
69189aa4deab5375d296c2e7,29/07/2022,G3a,36178,178,78,LLC,2025-11-15 15:22:12.908,2025-11-15 15:22:12.908,0,2022-07-29
69189aa5deab5375d296c2fc,29/07/2022,G4b,4044,044,44,CCC,2025-11-15 15:22:13.406,2025-11-15 15:22:13.406,0,2022-07-29
69189aa6deab5375d296c329,29/07/2022,G7d,16,16,16,,2025-11-15 15:22:14.476,2025-11-15 15:22:14.476,0,2022-07-29
69189aa5deab5375d296c302,29/07/2022,G4d,9291,291,91,CLL,2025-11-15 15:22:13.549,2025-11-15 15:22:13.549,0,2022-07-29
69189aa6deab5375d296c323,29/07/2022,G7b,15,15,15,,2025-11-15 15:22:14.332,2025-11-15 15:22:14.332,0,2022-07-29
69189aa6deab5375d296c320,29/07/2022,G7a,49,49,49,,2025-11-15 15:22:14.261,2025-11-15 15:22:14.261,0,2022-07-29
69189aa6deab5375d296c31d,29/07/2022,G6c,725,725,25,LCL,2025-11-15 15:22:14.190,2025-11-15 15:22:14.190,0,2022-07-29
69189aa6deab5375d296c31a,29/07/2022,G6b,149,149,49,LCL,2025-11-15 15:22:14.118,2025-11-15 15:22:14.118,0,2022-07-29
69189aa6deab5375d296c317,29/07/2022,G6a,394,394,94,LLC,2025-11-15 15:22:14.047,2025-11-15 15:22:14.047,0,2022-07-29
69189aa6deab5375d296c326,29/07/2022,G7c,41,41,41,,2025-11-15 15:22:14.404,2025-11-15 15:22:14.404,0,2022-07-29
69189aa5deab5375d296c311,29/07/2022,G5e,9484,484,84,CCC,2025-11-15 15:22:13.905,2025-11-15 15:22:13.905,0,2022-07-29
69189aa5deab5375d296c314,29/07/2022,G5f,3294,294,94,CLC,2025-11-15 15:22:13.976,2025-11-15 15:22:13.976,0,2022-07-29
69189aa5deab5375d296c305,29/07/2022,G5a,0020,020,20,CCC,2025-11-15 15:22:13.619,2025-11-15 15:22:13.619,0,2022-07-29
69189aa5deab5375d296c2ff,29/07/2022,G4c,4771,771,71,LLL,2025-11-15 15:22:13.478,2025-11-15 15:22:13.478,0,2022-07-29
69189aa5deab5375d296c30b,29/07/2022,G5c,4532,532,32,LLC,2025-11-15 15:22:13.762,2025-11-15 15:22:13.762,0,2022-07-29
69189aa5deab5375d296c30e,29/07/2022,G5d,9624,624,24,CCC,2025-11-15 15:22:13.834,2025-11-15 15:22:13.834,0,2022-07-29
69189aa5deab5375d296c308,29/07/2022,G5b,5037,037,37,CLL,2025-11-15 15:22:13.690,2025-11-15 15:22:13.690,0,2022-07-29
69189aa3deab5375d296c2ab,30/07/2022,G4b,0498,498,98,CLC,2025-11-15 15:22:11.460,2025-11-15 15:22:11.460,0,2022-07-30
69189aa2deab5375d296c28a,30/07/2022,ĐB,96409,409,09,CCL,2025-11-15 15:22:10.661,2025-11-15 15:22:10.661,0,2022-07-30
69189aa2deab5375d296c28d,30/07/2022,G1,33297,297,97,CLL,2025-11-15 15:22:10.733,2025-11-15 15:22:10.733,0,2022-07-30
69189aa2deab5375d296c290,30/07/2022,G2a,98099,099,99,CLL,2025-11-15 15:22:10.804,2025-11-15 15:22:10.804,0,2022-07-30
69189aa2deab5375d296c296,30/07/2022,G3a,75396,396,96,LLC,2025-11-15 15:22:10.956,2025-11-15 15:22:10.956,0,2022-07-30
69189aa3deab5375d296c299,30/07/2022,G3b,28088,088,88,CCC,2025-11-15 15:22:11.028,2025-11-15 15:22:11.028,0,2022-07-30
69189aa3deab5375d296c29c,30/07/2022,G3c,46255,255,55,CLL,2025-11-15 15:22:11.103,2025-11-15 15:22:11.103,0,2022-07-30
69189aa3deab5375d296c29f,30/07/2022,G3d,18481,481,81,CCL,2025-11-15 15:22:11.175,2025-11-15 15:22:11.175,0,2022-07-30
69189aa3deab5375d296c2a2,30/07/2022,G3e,39865,865,65,CCL,2025-11-15 15:22:11.247,2025-11-15 15:22:11.247,0,2022-07-30
69189aa3deab5375d296c2a5,30/07/2022,G3f,20146,146,46,LCC,2025-11-15 15:22:11.318,2025-11-15 15:22:11.318,0,2022-07-30
69189aa3deab5375d296c2a8,30/07/2022,G4a,9948,948,48,LCC,2025-11-15 15:22:11.390,2025-11-15 15:22:11.390,0,2022-07-30
69189aa2deab5375d296c293,30/07/2022,G2b,05132,132,32,LLC,2025-11-15 15:22:10.883,2025-11-15 15:22:10.883,0,2022-07-30
69189aa3deab5375d296c2ae,30/07/2022,G4c,4546,546,46,LCC,2025-11-15 15:22:11.531,2025-11-15 15:22:11.531,0,2022-07-30
69189aa3deab5375d296c2b4,30/07/2022,G5a,5489,489,89,CCL,2025-11-15 15:22:11.674,2025-11-15 15:22:11.674,0,2022-07-30
69189aa3deab5375d296c2b1,30/07/2022,G4d,5949,949,49,LCL,2025-11-15 15:22:11.603,2025-11-15 15:22:11.603,0,2022-07-30
69189aa4deab5375d296c2d5,30/07/2022,G7c,82,82,82,,2025-11-15 15:22:12.458,2025-11-15 15:22:12.458,0,2022-07-30
69189aa4deab5375d296c2d2,30/07/2022,G7b,81,81,81,,2025-11-15 15:22:12.386,2025-11-15 15:22:12.386,0,2022-07-30
69189aa4deab5375d296c2cf,30/07/2022,G7a,98,98,98,,2025-11-15 15:22:12.315,2025-11-15 15:22:12.315,0,2022-07-30
69189aa4deab5375d296c2cc,30/07/2022,G6c,354,354,54,LLC,2025-11-15 15:22:12.244,2025-11-15 15:22:12.244,0,2022-07-30
69189aa4deab5375d296c2c9,30/07/2022,G6b,754,754,54,LLC,2025-11-15 15:22:12.173,2025-11-15 15:22:12.173,0,2022-07-30
69189aa4deab5375d296c2d8,30/07/2022,G7d,60,60,60,,2025-11-15 15:22:12.529,2025-11-15 15:22:12.529,0,2022-07-30
69189aa4deab5375d296c2c3,30/07/2022,G5f,8252,252,52,CLC,2025-11-15 15:22:12.030,2025-11-15 15:22:12.030,0,2022-07-30
69189aa3deab5375d296c2c0,30/07/2022,G5e,8455,455,55,CLL,2025-11-15 15:22:11.959,2025-11-15 15:22:11.959,0,2022-07-30
69189aa3deab5375d296c2bd,30/07/2022,G5d,3077,077,77,CLL,2025-11-15 15:22:11.887,2025-11-15 15:22:11.887,0,2022-07-30
69189aa3deab5375d296c2ba,30/07/2022,G5c,2610,610,10,CLC,2025-11-15 15:22:11.816,2025-11-15 15:22:11.816,0,2022-07-30
69189aa3deab5375d296c2b7,30/07/2022,G5b,2998,998,98,LLC,2025-11-15 15:22:11.745,2025-11-15 15:22:11.745,0,2022-07-30
69189aa4deab5375d296c2c6,30/07/2022,G6a,987,987,87,LCL,2025-11-15 15:22:12.101,2025-11-15 15:22:12.101,0,2022-07-30
69189aa1deab5375d296c254,31/07/2022,G3f,00835,835,35,CLL,2025-11-15 15:22:09.359,2025-11-15 15:22:09.359,0,2022-07-31
69189aa1deab5375d296c251,31/07/2022,G3e,37463,463,63,CCL,2025-11-15 15:22:09.288,2025-11-15 15:22:09.288,0,2022-07-31
69189aa1deab5375d296c24e,31/07/2022,G3d,56864,864,64,CCC,2025-11-15 15:22:09.217,2025-11-15 15:22:09.217,0,2022-07-31
69189aa1deab5375d296c24b,31/07/2022,G3c,92400,400,00,CCC,2025-11-15 15:22:09.145,2025-11-15 15:22:09.145,0,2022-07-31
69189aa1deab5375d296c248,31/07/2022,G3b,84841,841,41,CCL,2025-11-15 15:22:09.073,2025-11-15 15:22:09.073,0,2022-07-31
69189aa0deab5375d296c23f,31/07/2022,G2a,88354,354,54,LLC,2025-11-15 15:22:08.860,2025-11-15 15:22:08.860,0,2022-07-31
69189aa0deab5375d296c242,31/07/2022,G2b,35612,612,12,CLC,2025-11-15 15:22:08.931,2025-11-15 15:22:08.931,0,2022-07-31
69189aa0deab5375d296c23c,31/07/2022,G1,02643,643,43,CCL,2025-11-15 15:22:08.788,2025-11-15 15:22:08.788,0,2022-07-31
69189aa0deab5375d296c239,31/07/2022,ĐB,50267,267,67,CCL,2025-11-15 15:22:08.717,2025-11-15 15:22:08.717,0,2022-07-31
69189aa1deab5375d296c257,31/07/2022,G4a,7282,282,82,CCC,2025-11-15 15:22:09.431,2025-11-15 15:22:09.431,0,2022-07-31
69189aa1deab5375d296c245,31/07/2022,G3a,11215,215,15,CLL,2025-11-15 15:22:09.002,2025-11-15 15:22:09.002,0,2022-07-31
69189aa1deab5375d296c25a,31/07/2022,G4b,2781,781,81,LCL,2025-11-15 15:22:09.505,2025-11-15 15:22:09.505,0,2022-07-31
69189aa2deab5375d296c272,31/07/2022,G5f,7338,338,38,LLC,2025-11-15 15:22:10.076,2025-11-15 15:22:10.076,0,2022-07-31
69189aa1deab5375d296c260,31/07/2022,G4d,3005,005,05,CCL,2025-11-15 15:22:09.647,2025-11-15 15:22:09.647,0,2022-07-31
69189aa1deab5375d296c25d,31/07/2022,G4c,4459,459,59,CLL,2025-11-15 15:22:09.576,2025-11-15 15:22:09.576,0,2022-07-31
69189aa2deab5375d296c281,31/07/2022,G7b,94,94,94,,2025-11-15 15:22:10.446,2025-11-15 15:22:10.446,0,2022-07-31
69189aa2deab5375d296c27e,31/07/2022,G7a,07,07,07,,2025-11-15 15:22:10.361,2025-11-15 15:22:10.361,0,2022-07-31
69189aa2deab5375d296c27b,31/07/2022,G6c,515,515,15,LLL,2025-11-15 15:22:10.290,2025-11-15 15:22:10.290,0,2022-07-31
69189aa2deab5375d296c278,31/07/2022,G6b,582,582,82,LCC,2025-11-15 15:22:10.219,2025-11-15 15:22:10.219,0,2022-07-31
69189aa2deab5375d296c275,31/07/2022,G6a,400,400,00,CCC,2025-11-15 15:22:10.148,2025-11-15 15:22:10.148,0,2022-07-31
69189aa2deab5375d296c284,31/07/2022,G7c,69,69,69,,2025-11-15 15:22:10.517,2025-11-15 15:22:10.517,0,2022-07-31
69189aa2deab5375d296c26f,31/07/2022,G5e,8253,253,53,CLL,2025-11-15 15:22:10.004,2025-11-15 15:22:10.004,0,2022-07-31
69189aa1deab5375d296c26c,31/07/2022,G5d,3177,177,77,LLL,2025-11-15 15:22:09.933,2025-11-15 15:22:09.933,0,2022-07-31
69189aa1deab5375d296c269,31/07/2022,G5c,8227,227,27,CCL,2025-11-15 15:22:09.862,2025-11-15 15:22:09.862,0,2022-07-31
69189aa1deab5375d296c266,31/07/2022,G5b,4673,673,73,CLL,2025-11-15 15:22:09.790,2025-11-15 15:22:09.790,0,2022-07-31
69189aa1deab5375d296c263,31/07/2022,G5a,3579,579,79,LLL,2025-11-15 15:22:09.719,2025-11-15 15:22:09.719,0,2022-07-31
69189aa2deab5375d296c287,31/07/2022,G7d,52,52,52,,2025-11-15 15:22:10.589,2025-11-15 15:22:10.589,0,2022-07-31
69189a9fdeab5375d296c203,01/08/2022,G3f,69111,111,11,LLL,2025-11-15 15:22:07.428,2025-11-15 15:22:07.428,0,2022-08-01
69189a9fdeab5375d296c200,01/08/2022,G3e,69528,528,28,LCC,2025-11-15 15:22:07.357,2025-11-15 15:22:07.357,0,2022-08-01
69189a9fdeab5375d296c1fd,01/08/2022,G3d,46622,622,22,CCC,2025-11-15 15:22:07.285,2025-11-15 15:22:07.285,0,2022-08-01
69189a9fdeab5375d296c1fa,01/08/2022,G3c,96540,540,40,LCC,2025-11-15 15:22:07.213,2025-11-15 15:22:07.213,0,2022-08-01
69189a9fdeab5375d296c1f7,01/08/2022,G3b,21977,977,77,LLL,2025-11-15 15:22:07.142,2025-11-15 15:22:07.142,0,2022-08-01
69189a9edeab5375d296c1ee,01/08/2022,G2a,44331,331,31,LLL,2025-11-15 15:22:06.927,2025-11-15 15:22:06.927,0,2022-08-01
69189a9edeab5375d296c1f1,01/08/2022,G2b,72670,670,70,CLC,2025-11-15 15:22:06.998,2025-11-15 15:22:06.998,0,2022-08-01
69189a9edeab5375d296c1eb,01/08/2022,G1,11459,459,59,CLL,2025-11-15 15:22:06.855,2025-11-15 15:22:06.855,0,2022-08-01
69189a9edeab5375d296c1e8,01/08/2022,ĐB,46555,555,55,LLL,2025-11-15 15:22:06.783,2025-11-15 15:22:06.783,0,2022-08-01
69189a9fdeab5375d296c206,01/08/2022,G4a,8040,040,40,CCC,2025-11-15 15:22:07.499,2025-11-15 15:22:07.499,0,2022-08-01
69189a9fdeab5375d296c1f4,01/08/2022,G3a,09791,791,91,LLL,2025-11-15 15:22:07.070,2025-11-15 15:22:07.070,0,2022-08-01
69189a9fdeab5375d296c209,01/08/2022,G4b,4166,166,66,LCC,2025-11-15 15:22:07.570,2025-11-15 15:22:07.570,0,2022-08-01
69189a9fdeab5375d296c20c,01/08/2022,G4c,2393,393,93,LLL,2025-11-15 15:22:07.642,2025-11-15 15:22:07.642,0,2022-08-01
69189a9fdeab5375d296c20f,01/08/2022,G4d,5238,238,38,CLC,2025-11-15 15:22:07.713,2025-11-15 15:22:07.713,0,2022-08-01
69189aa0deab5375d296c236,01/08/2022,G7d,08,08,08,,2025-11-15 15:22:08.645,2025-11-15 15:22:08.645,0,2022-08-01
69189aa0deab5375d296c230,01/08/2022,G7b,62,62,62,,2025-11-15 15:22:08.500,2025-11-15 15:22:08.500,0,2022-08-01
69189aa0deab5375d296c22d,01/08/2022,G7a,05,05,05,,2025-11-15 15:22:08.428,2025-11-15 15:22:08.428,0,2022-08-01
69189aa0deab5375d296c22a,01/08/2022,G6c,297,297,97,CLL,2025-11-15 15:22:08.357,2025-11-15 15:22:08.357,0,2022-08-01
69189aa0deab5375d296c227,01/08/2022,G6b,962,962,62,LCC,2025-11-15 15:22:08.286,2025-11-15 15:22:08.286,0,2022-08-01
69189aa0deab5375d296c224,01/08/2022,G6a,693,693,93,CLL,2025-11-15 15:22:08.214,2025-11-15 15:22:08.214,0,2022-08-01
69189aa0deab5375d296c233,01/08/2022,G7c,33,33,33,,2025-11-15 15:22:08.572,2025-11-15 15:22:08.572,0,2022-08-01
69189aa0deab5375d296c21e,01/08/2022,G5e,0291,291,91,CLL,2025-11-15 15:22:08.072,2025-11-15 15:22:08.072,0,2022-08-01
69189a9fdeab5375d296c21b,01/08/2022,G5d,0507,507,07,LCL,2025-11-15 15:22:07.998,2025-11-15 15:22:07.998,0,2022-08-01
69189a9fdeab5375d296c218,01/08/2022,G5c,1948,948,48,LCC,2025-11-15 15:22:07.927,2025-11-15 15:22:07.927,0,2022-08-01
69189a9fdeab5375d296c215,01/08/2022,G5b,2597,597,97,LLL,2025-11-15 15:22:07.856,2025-11-15 15:22:07.856,0,2022-08-01
69189a9fdeab5375d296c212,01/08/2022,G5a,5081,081,81,CCL,2025-11-15 15:22:07.785,2025-11-15 15:22:07.785,0,2022-08-01
69189aa0deab5375d296c221,01/08/2022,G5f,3793,793,93,LLL,2025-11-15 15:22:08.143,2025-11-15 15:22:08.143,0,2022-08-01
69189a9ddeab5375d296c1b2,02/08/2022,G3f,23625,625,25,CCL,2025-11-15 15:22:05.500,2025-11-15 15:22:05.500,0,2022-08-02
69189a9ddeab5375d296c1af,02/08/2022,G3e,76608,608,08,CCC,2025-11-15 15:22:05.428,2025-11-15 15:22:05.428,0,2022-08-02
69189a9ddeab5375d296c1ac,02/08/2022,G3d,62577,577,77,LLL,2025-11-15 15:22:05.357,2025-11-15 15:22:05.357,0,2022-08-02
69189a9ddeab5375d296c1a9,02/08/2022,G3c,03670,670,70,CLC,2025-11-15 15:22:05.286,2025-11-15 15:22:05.286,0,2022-08-02
69189a9ddeab5375d296c1a6,02/08/2022,G3b,25643,643,43,CCL,2025-11-15 15:22:05.215,2025-11-15 15:22:05.215,0,2022-08-02
69189a9cdeab5375d296c19d,02/08/2022,G2a,10945,945,45,LCL,2025-11-15 15:22:04.999,2025-11-15 15:22:04.999,0,2022-08-02
69189a9ddeab5375d296c1a0,02/08/2022,G2b,04382,382,82,LCC,2025-11-15 15:22:05.071,2025-11-15 15:22:05.071,0,2022-08-02
69189a9cdeab5375d296c19a,02/08/2022,G1,79490,490,90,CLC,2025-11-15 15:22:04.926,2025-11-15 15:22:04.926,0,2022-08-02
69189a9cdeab5375d296c197,02/08/2022,ĐB,36335,335,35,LLL,2025-11-15 15:22:04.854,2025-11-15 15:22:04.854,0,2022-08-02
69189a9ddeab5375d296c1b5,02/08/2022,G4a,1076,076,76,CLC,2025-11-15 15:22:05.570,2025-11-15 15:22:05.570,0,2022-08-02
69189a9ddeab5375d296c1a3,02/08/2022,G3a,97683,683,83,CCL,2025-11-15 15:22:05.142,2025-11-15 15:22:05.142,0,2022-08-02
69189a9ddeab5375d296c1b8,02/08/2022,G4b,7029,029,29,CCL,2025-11-15 15:22:05.641,2025-11-15 15:22:05.641,0,2022-08-02
69189a9edeab5375d296c1e5,02/08/2022,G7d,93,93,93,,2025-11-15 15:22:06.712,2025-11-15 15:22:06.712,0,2022-08-02
69189a9ddeab5375d296c1be,02/08/2022,G4d,7292,292,92,CLC,2025-11-15 15:22:05.784,2025-11-15 15:22:05.784,0,2022-08-02
69189a9ddeab5375d296c1bb,02/08/2022,G4c,2491,491,91,CLL,2025-11-15 15:22:05.712,2025-11-15 15:22:05.712,0,2022-08-02
69189a9edeab5375d296c1df,02/08/2022,G7b,21,21,21,,2025-11-15 15:22:06.569,2025-11-15 15:22:06.569,0,2022-08-02
69189a9edeab5375d296c1dc,02/08/2022,G7a,67,67,67,,2025-11-15 15:22:06.497,2025-11-15 15:22:06.497,0,2022-08-02
69189a9edeab5375d296c1d9,02/08/2022,G6c,480,480,80,CCC,2025-11-15 15:22:06.426,2025-11-15 15:22:06.426,0,2022-08-02
69189a9edeab5375d296c1d6,02/08/2022,G6b,098,098,98,CLC,2025-11-15 15:22:06.354,2025-11-15 15:22:06.354,0,2022-08-02
69189a9edeab5375d296c1d3,02/08/2022,G6a,138,138,38,LLC,2025-11-15 15:22:06.283,2025-11-15 15:22:06.283,0,2022-08-02
69189a9edeab5375d296c1e2,02/08/2022,G7c,06,06,06,,2025-11-15 15:22:06.640,2025-11-15 15:22:06.640,0,2022-08-02
69189a9edeab5375d296c1cd,02/08/2022,G5e,6830,830,30,CLC,2025-11-15 15:22:06.140,2025-11-15 15:22:06.140,0,2022-08-02
69189a9edeab5375d296c1ca,02/08/2022,G5d,4791,791,91,LLL,2025-11-15 15:22:06.069,2025-11-15 15:22:06.069,0,2022-08-02
69189a9ddeab5375d296c1c7,02/08/2022,G5c,1403,403,03,CCL,2025-11-15 15:22:05.998,2025-11-15 15:22:05.998,0,2022-08-02
69189a9ddeab5375d296c1c4,02/08/2022,G5b,1170,170,70,LLC,2025-11-15 15:22:05.927,2025-11-15 15:22:05.927,0,2022-08-02
69189a9ddeab5375d296c1c1,02/08/2022,G5a,5511,511,11,LLL,2025-11-15 15:22:05.856,2025-11-15 15:22:05.856,0,2022-08-02
69189a9edeab5375d296c1d0,02/08/2022,G5f,1185,185,85,LCL,2025-11-15 15:22:06.211,2025-11-15 15:22:06.211,0,2022-08-02
69189a9bdeab5375d296c161,03/08/2022,G3f,18642,642,42,CCC,2025-11-15 15:22:03.562,2025-11-15 15:22:03.562,0,2022-08-03
69189a9bdeab5375d296c15e,03/08/2022,G3e,24773,773,73,LLL,2025-11-15 15:22:03.490,2025-11-15 15:22:03.490,0,2022-08-03
69189a9bdeab5375d296c15b,03/08/2022,G3d,06574,574,74,LLC,2025-11-15 15:22:03.407,2025-11-15 15:22:03.407,0,2022-08-03
69189a9bdeab5375d296c158,03/08/2022,G3c,77309,309,09,LCL,2025-11-15 15:22:03.322,2025-11-15 15:22:03.322,0,2022-08-03
69189a9bdeab5375d296c155,03/08/2022,G3b,82314,314,14,LLC,2025-11-15 15:22:03.250,2025-11-15 15:22:03.250,0,2022-08-03
69189a9bdeab5375d296c14c,03/08/2022,G2a,33660,660,60,CCC,2025-11-15 15:22:03.026,2025-11-15 15:22:03.026,0,2022-08-03
69189a9bdeab5375d296c14f,03/08/2022,G2b,43875,875,75,CLL,2025-11-15 15:22:03.105,2025-11-15 15:22:03.105,0,2022-08-03
69189a9adeab5375d296c149,03/08/2022,G1,60371,371,71,LLL,2025-11-15 15:22:02.954,2025-11-15 15:22:02.954,0,2022-08-03
69189a9adeab5375d296c146,03/08/2022,ĐB,37686,686,86,CCC,2025-11-15 15:22:02.874,2025-11-15 15:22:02.874,0,2022-08-03
69189a9bdeab5375d296c164,03/08/2022,G4a,9148,148,48,LCC,2025-11-15 15:22:03.635,2025-11-15 15:22:03.635,0,2022-08-03
69189a9bdeab5375d296c152,03/08/2022,G3a,55527,527,27,LCL,2025-11-15 15:22:03.177,2025-11-15 15:22:03.177,0,2022-08-03
69189a9bdeab5375d296c167,03/08/2022,G4b,3426,426,26,CCC,2025-11-15 15:22:03.706,2025-11-15 15:22:03.706,0,2022-08-03
69189a9cdeab5375d296c194,03/08/2022,G7d,46,46,46,,2025-11-15 15:22:04.783,2025-11-15 15:22:04.783,0,2022-08-03
69189a9bdeab5375d296c16d,03/08/2022,G4d,7519,519,19,LLL,2025-11-15 15:22:03.851,2025-11-15 15:22:03.851,0,2022-08-03
69189a9cdeab5375d296c18e,03/08/2022,G7b,86,86,86,,2025-11-15 15:22:04.641,2025-11-15 15:22:04.641,0,2022-08-03
69189a9cdeab5375d296c18b,03/08/2022,G7a,18,18,18,,2025-11-15 15:22:04.570,2025-11-15 15:22:04.570,0,2022-08-03
69189a9cdeab5375d296c188,03/08/2022,G6c,515,515,15,LLL,2025-11-15 15:22:04.498,2025-11-15 15:22:04.498,0,2022-08-03
69189a9cdeab5375d296c185,03/08/2022,G6b,240,240,40,CCC,2025-11-15 15:22:04.427,2025-11-15 15:22:04.427,0,2022-08-03
69189a9cdeab5375d296c182,03/08/2022,G6a,686,686,86,CCC,2025-11-15 15:22:04.356,2025-11-15 15:22:04.356,0,2022-08-03
69189a9cdeab5375d296c191,03/08/2022,G7c,51,51,51,,2025-11-15 15:22:04.712,2025-11-15 15:22:04.712,0,2022-08-03
69189a9cdeab5375d296c17c,03/08/2022,G5e,2334,334,34,LLC,2025-11-15 15:22:04.208,2025-11-15 15:22:04.208,0,2022-08-03
69189a9cdeab5375d296c17f,03/08/2022,G5f,6678,678,78,CLC,2025-11-15 15:22:04.284,2025-11-15 15:22:04.284,0,2022-08-03
69189a9bdeab5375d296c170,03/08/2022,G5a,9150,150,50,LLC,2025-11-15 15:22:03.922,2025-11-15 15:22:03.922,0,2022-08-03
69189a9bdeab5375d296c16a,03/08/2022,G4c,1501,501,01,LCL,2025-11-15 15:22:03.779,2025-11-15 15:22:03.779,0,2022-08-03
69189a9cdeab5375d296c176,03/08/2022,G5c,3983,983,83,LCL,2025-11-15 15:22:04.065,2025-11-15 15:22:04.065,0,2022-08-03
69189a9cdeab5375d296c179,03/08/2022,G5d,1193,193,93,LLL,2025-11-15 15:22:04.136,2025-11-15 15:22:04.136,0,2022-08-03
69189a9bdeab5375d296c173,03/08/2022,G5b,5760,760,60,LCC,2025-11-15 15:22:03.994,2025-11-15 15:22:03.994,0,2022-08-03
69189a99deab5375d296c116,04/08/2022,G4b,4553,553,53,LLL,2025-11-15 15:22:01.688,2025-11-15 15:22:01.688,0,2022-08-04
69189a98deab5375d296c0f5,04/08/2022,ĐB,27492,492,92,CLC,2025-11-15 15:22:00.898,2025-11-15 15:22:00.898,0,2022-08-04
69189a98deab5375d296c0f8,04/08/2022,G1,50569,569,69,LCL,2025-11-15 15:22:00.971,2025-11-15 15:22:00.971,0,2022-08-04
69189a99deab5375d296c0fb,04/08/2022,G2a,07770,770,70,LLC,2025-11-15 15:22:01.042,2025-11-15 15:22:01.042,0,2022-08-04
69189a99deab5375d296c101,04/08/2022,G3a,50365,365,65,LCL,2025-11-15 15:22:01.185,2025-11-15 15:22:01.185,0,2022-08-04
69189a99deab5375d296c104,04/08/2022,G3b,06019,019,19,CLL,2025-11-15 15:22:01.257,2025-11-15 15:22:01.257,0,2022-08-04
69189a99deab5375d296c107,04/08/2022,G3c,82717,717,17,LLL,2025-11-15 15:22:01.331,2025-11-15 15:22:01.331,0,2022-08-04
69189a99deab5375d296c10a,04/08/2022,G3d,45685,685,85,CCL,2025-11-15 15:22:01.403,2025-11-15 15:22:01.403,0,2022-08-04
69189a99deab5375d296c10d,04/08/2022,G3e,55631,631,31,CLL,2025-11-15 15:22:01.476,2025-11-15 15:22:01.476,0,2022-08-04
69189a99deab5375d296c110,04/08/2022,G3f,41612,612,12,CLC,2025-11-15 15:22:01.547,2025-11-15 15:22:01.547,0,2022-08-04
69189a99deab5375d296c113,04/08/2022,G4a,2894,894,94,CLC,2025-11-15 15:22:01.617,2025-11-15 15:22:01.617,0,2022-08-04
69189a99deab5375d296c0fe,04/08/2022,G2b,83906,906,06,LCC,2025-11-15 15:22:01.113,2025-11-15 15:22:01.113,0,2022-08-04
69189a99deab5375d296c119,04/08/2022,G4c,2442,442,42,CCC,2025-11-15 15:22:01.760,2025-11-15 15:22:01.760,0,2022-08-04
69189a99deab5375d296c11f,04/08/2022,G5a,3139,139,39,LLL,2025-11-15 15:22:01.903,2025-11-15 15:22:01.903,0,2022-08-04
69189a99deab5375d296c11c,04/08/2022,G4d,6401,401,01,CCL,2025-11-15 15:22:01.832,2025-11-15 15:22:01.832,0,2022-08-04
69189a9adeab5375d296c140,04/08/2022,G7c,29,29,29,,2025-11-15 15:22:02.724,2025-11-15 15:22:02.724,0,2022-08-04
69189a9adeab5375d296c13d,04/08/2022,G7b,36,36,36,,2025-11-15 15:22:02.652,2025-11-15 15:22:02.652,0,2022-08-04
69189a9adeab5375d296c13a,04/08/2022,G7a,37,37,37,,2025-11-15 15:22:02.579,2025-11-15 15:22:02.579,0,2022-08-04
69189a9adeab5375d296c137,04/08/2022,G6c,289,289,89,CCL,2025-11-15 15:22:02.506,2025-11-15 15:22:02.506,0,2022-08-04
69189a9adeab5375d296c134,04/08/2022,G6b,393,393,93,LLL,2025-11-15 15:22:02.432,2025-11-15 15:22:02.432,0,2022-08-04
69189a9adeab5375d296c143,04/08/2022,G7d,24,24,24,,2025-11-15 15:22:02.797,2025-11-15 15:22:02.797,0,2022-08-04
69189a9adeab5375d296c12e,04/08/2022,G5f,0743,743,43,LCL,2025-11-15 15:22:02.265,2025-11-15 15:22:02.265,0,2022-08-04
69189a9adeab5375d296c12b,04/08/2022,G5e,9701,701,01,LCL,2025-11-15 15:22:02.192,2025-11-15 15:22:02.192,0,2022-08-04
69189a9adeab5375d296c128,04/08/2022,G5d,1868,868,68,CCC,2025-11-15 15:22:02.120,2025-11-15 15:22:02.120,0,2022-08-04
69189a9adeab5375d296c125,04/08/2022,G5c,4573,573,73,LLL,2025-11-15 15:22:02.047,2025-11-15 15:22:02.047,0,2022-08-04
69189a99deab5375d296c122,04/08/2022,G5b,6062,062,62,CCC,2025-11-15 15:22:01.975,2025-11-15 15:22:01.975,0,2022-08-04
69189a9adeab5375d296c131,04/08/2022,G6a,972,972,72,LLC,2025-11-15 15:22:02.337,2025-11-15 15:22:02.337,0,2022-08-04
69189a97deab5375d296c0bf,05/08/2022,G3f,07823,823,23,CCL,2025-11-15 15:21:59.594,2025-11-15 15:21:59.594,0,2022-08-05
69189a97deab5375d296c0bc,05/08/2022,G3e,35384,384,84,LCC,2025-11-15 15:21:59.522,2025-11-15 15:21:59.522,0,2022-08-05
69189a97deab5375d296c0b9,05/08/2022,G3d,71315,315,15,LLL,2025-11-15 15:21:59.450,2025-11-15 15:21:59.450,0,2022-08-05
69189a97deab5375d296c0b6,05/08/2022,G3c,93413,413,13,CLL,2025-11-15 15:21:59.378,2025-11-15 15:21:59.378,0,2022-08-05
69189a97deab5375d296c0b3,05/08/2022,G3b,68922,922,22,LCC,2025-11-15 15:21:59.305,2025-11-15 15:21:59.305,0,2022-08-05
69189a97deab5375d296c0aa,05/08/2022,G2a,13523,523,23,LCL,2025-11-15 15:21:59.083,2025-11-15 15:21:59.083,0,2022-08-05
69189a97deab5375d296c0ad,05/08/2022,G2b,80169,169,69,LCL,2025-11-15 15:21:59.154,2025-11-15 15:21:59.154,0,2022-08-05
69189a97deab5375d296c0a7,05/08/2022,G1,91374,374,74,LLC,2025-11-15 15:21:59.012,2025-11-15 15:21:59.012,0,2022-08-05
69189a96deab5375d296c0a4,05/08/2022,ĐB,49513,513,13,LLL,2025-11-15 15:21:58.939,2025-11-15 15:21:58.939,0,2022-08-05
69189a97deab5375d296c0c2,05/08/2022,G4a,0393,393,93,LLL,2025-11-15 15:21:59.672,2025-11-15 15:21:59.672,0,2022-08-05
69189a97deab5375d296c0b0,05/08/2022,G3a,21823,823,23,CCL,2025-11-15 15:21:59.232,2025-11-15 15:21:59.232,0,2022-08-05
69189a97deab5375d296c0c5,05/08/2022,G4b,0045,045,45,CCL,2025-11-15 15:21:59.744,2025-11-15 15:21:59.744,0,2022-08-05
69189a98deab5375d296c0f2,05/08/2022,G7d,67,67,67,,2025-11-15 15:22:00.825,2025-11-15 15:22:00.825,0,2022-08-05
69189a97deab5375d296c0cb,05/08/2022,G4d,7989,989,89,LCL,2025-11-15 15:21:59.889,2025-11-15 15:21:59.889,0,2022-08-05
69189a98deab5375d296c0ef,05/08/2022,G7c,14,14,14,,2025-11-15 15:22:00.753,2025-11-15 15:22:00.753,0,2022-08-05
69189a98deab5375d296c0ec,05/08/2022,G7b,16,16,16,,2025-11-15 15:22:00.681,2025-11-15 15:22:00.681,0,2022-08-05
69189a98deab5375d296c0e9,05/08/2022,G7a,73,73,73,,2025-11-15 15:22:00.609,2025-11-15 15:22:00.609,0,2022-08-05
69189a98deab5375d296c0e6,05/08/2022,G6c,794,794,94,LLC,2025-11-15 15:22:00.537,2025-11-15 15:22:00.537,0,2022-08-05
69189a98deab5375d296c0e3,05/08/2022,G6b,991,991,91,LLL,2025-11-15 15:22:00.464,2025-11-15 15:22:00.464,0,2022-08-05
69189a98deab5375d296c0e0,05/08/2022,G6a,840,840,40,CCC,2025-11-15 15:22:00.393,2025-11-15 15:22:00.393,0,2022-08-05
69189a97deab5375d296c0c8,05/08/2022,G4c,1630,630,30,CLC,2025-11-15 15:21:59.817,2025-11-15 15:21:59.817,0,2022-08-05
69189a98deab5375d296c0da,05/08/2022,G5e,2888,888,88,CCC,2025-11-15 15:22:00.250,2025-11-15 15:22:00.250,0,2022-08-05
69189a98deab5375d296c0d7,05/08/2022,G5d,1847,847,47,CCL,2025-11-15 15:22:00.178,2025-11-15 15:22:00.178,0,2022-08-05
69189a98deab5375d296c0d4,05/08/2022,G5c,8901,901,01,LCL,2025-11-15 15:22:00.106,2025-11-15 15:22:00.106,0,2022-08-05
69189a98deab5375d296c0d1,05/08/2022,G5b,7088,088,88,CCC,2025-11-15 15:22:00.033,2025-11-15 15:22:00.033,0,2022-08-05
69189a97deab5375d296c0ce,05/08/2022,G5a,5811,811,11,CLL,2025-11-15 15:21:59.962,2025-11-15 15:21:59.962,0,2022-08-05
69189a98deab5375d296c0dd,05/08/2022,G5f,9731,731,31,LLL,2025-11-15 15:22:00.321,2025-11-15 15:22:00.321,0,2022-08-05
69189a95deab5375d296c06e,06/08/2022,G3f,76821,821,21,CCL,2025-11-15 15:21:57.645,2025-11-15 15:21:57.645,0,2022-08-06
69189a95deab5375d296c068,06/08/2022,G3d,81307,307,07,LCL,2025-11-15 15:21:57.501,2025-11-15 15:21:57.501,0,2022-08-06
69189a95deab5375d296c065,06/08/2022,G3c,88725,725,25,LCL,2025-11-15 15:21:57.429,2025-11-15 15:21:57.429,0,2022-08-06
69189a95deab5375d296c062,06/08/2022,G3b,82910,910,10,LLC,2025-11-15 15:21:57.358,2025-11-15 15:21:57.358,0,2022-08-06
69189a95deab5375d296c05c,06/08/2022,G2b,86446,446,46,CCC,2025-11-15 15:21:57.216,2025-11-15 15:21:57.216,0,2022-08-06
69189a95deab5375d296c071,06/08/2022,G4a,7562,562,62,LCC,2025-11-15 15:21:57.717,2025-11-15 15:21:57.717,0,2022-08-06
69189a95deab5375d296c059,06/08/2022,G2a,71609,609,09,CCL,2025-11-15 15:21:57.144,2025-11-15 15:21:57.144,0,2022-08-06
69189a95deab5375d296c056,06/08/2022,G1,78243,243,43,CCL,2025-11-15 15:21:57.074,2025-11-15 15:21:57.074,0,2022-08-06
69189a95deab5375d296c053,06/08/2022,ĐB,74873,873,73,CLL,2025-11-15 15:21:57.002,2025-11-15 15:21:57.002,0,2022-08-06
69189a95deab5375d296c05f,06/08/2022,G3a,61504,504,04,LCC,2025-11-15 15:21:57.287,2025-11-15 15:21:57.287,0,2022-08-06
69189a95deab5375d296c074,06/08/2022,G4b,1111,111,11,LLL,2025-11-15 15:21:57.789,2025-11-15 15:21:57.789,0,2022-08-06
69189a95deab5375d296c06b,06/08/2022,G3e,14382,382,82,LCC,2025-11-15 15:21:57.573,2025-11-15 15:21:57.573,0,2022-08-06
69189a96deab5375d296c0a1,06/08/2022,G7d,72,72,72,,2025-11-15 15:21:58.868,2025-11-15 15:21:58.868,0,2022-08-06
69189a95deab5375d296c07a,06/08/2022,G4d,4994,994,94,LLC,2025-11-15 15:21:57.931,2025-11-15 15:21:57.931,0,2022-08-06
69189a96deab5375d296c09e,06/08/2022,G7c,71,71,71,,2025-11-15 15:21:58.796,2025-11-15 15:21:58.796,0,2022-08-06
69189a96deab5375d296c09b,06/08/2022,G7b,69,69,69,,2025-11-15 15:21:58.724,2025-11-15 15:21:58.724,0,2022-08-06
69189a96deab5375d296c098,06/08/2022,G7a,27,27,27,,2025-11-15 15:21:58.652,2025-11-15 15:21:58.652,0,2022-08-06
69189a96deab5375d296c095,06/08/2022,G6c,836,836,36,CLC,2025-11-15 15:21:58.580,2025-11-15 15:21:58.580,0,2022-08-06
69189a96deab5375d296c092,06/08/2022,G6b,634,634,34,CLC,2025-11-15 15:21:58.507,2025-11-15 15:21:58.507,0,2022-08-06
69189a95deab5375d296c077,06/08/2022,G4c,9085,085,85,CCL,2025-11-15 15:21:57.860,2025-11-15 15:21:57.860,0,2022-08-06
69189a96deab5375d296c08c,06/08/2022,G5f,5644,644,44,CCC,2025-11-15 15:21:58.362,2025-11-15 15:21:58.362,0,2022-08-06
69189a96deab5375d296c089,06/08/2022,G5e,4759,759,59,LLL,2025-11-15 15:21:58.290,2025-11-15 15:21:58.290,0,2022-08-06
69189a96deab5375d296c086,06/08/2022,G5d,8637,637,37,CLL,2025-11-15 15:21:58.219,2025-11-15 15:21:58.219,0,2022-08-06
69189a96deab5375d296c083,06/08/2022,G5c,7458,458,58,CLC,2025-11-15 15:21:58.147,2025-11-15 15:21:58.147,0,2022-08-06
69189a96deab5375d296c080,06/08/2022,G5b,4825,825,25,CCL,2025-11-15 15:21:58.074,2025-11-15 15:21:58.074,0,2022-08-06
69189a96deab5375d296c07d,06/08/2022,G5a,5479,479,79,CLL,2025-11-15 15:21:58.002,2025-11-15 15:21:58.002,0,2022-08-06
69189a96deab5375d296c08f,06/08/2022,G6a,020,020,20,CCC,2025-11-15 15:21:58.434,2025-11-15 15:21:58.434,0,2022-08-06
69189a93deab5375d296c020,07/08/2022,G4a,8759,759,59,LLL,2025-11-15 15:21:55.759,2025-11-15 15:21:55.759,0,2022-08-07
69189a93deab5375d296c01d,07/08/2022,G3f,12585,585,85,LCL,2025-11-15 15:21:55.687,2025-11-15 15:21:55.687,0,2022-08-07
69189a93deab5375d296c01a,07/08/2022,G3e,86355,355,55,LLL,2025-11-15 15:21:55.616,2025-11-15 15:21:55.616,0,2022-08-07
69189a93deab5375d296c017,07/08/2022,G3d,99102,102,02,LCC,2025-11-15 15:21:55.544,2025-11-15 15:21:55.544,0,2022-08-07
69189a93deab5375d296c014,07/08/2022,G3c,25193,193,93,LLL,2025-11-15 15:21:55.472,2025-11-15 15:21:55.472,0,2022-08-07
69189a93deab5375d296c00b,07/08/2022,G2b,78144,144,44,LCC,2025-11-15 15:21:55.258,2025-11-15 15:21:55.258,0,2022-08-07
69189a93deab5375d296c00e,07/08/2022,G3a,59383,383,83,LCL,2025-11-15 15:21:55.329,2025-11-15 15:21:55.329,0,2022-08-07
69189a93deab5375d296c008,07/08/2022,G2a,25509,509,09,LCL,2025-11-15 15:21:55.186,2025-11-15 15:21:55.186,0,2022-08-07
69189a93deab5375d296c005,07/08/2022,G1,00604,604,04,CCC,2025-11-15 15:21:55.102,2025-11-15 15:21:55.102,0,2022-08-07
69189a93deab5375d296c002,07/08/2022,ĐB,80395,395,95,LLL,2025-11-15 15:21:55.030,2025-11-15 15:21:55.030,0,2022-08-07
69189a93deab5375d296c011,07/08/2022,G3b,34164,164,64,LCC,2025-11-15 15:21:55.401,2025-11-15 15:21:55.401,0,2022-08-07
69189a93deab5375d296c023,07/08/2022,G4b,8509,509,09,LCL,2025-11-15 15:21:55.831,2025-11-15 15:21:55.831,0,2022-08-07
69189a93deab5375d296c026,07/08/2022,G4c,1662,662,62,CCC,2025-11-15 15:21:55.902,2025-11-15 15:21:55.902,0,2022-08-07
69189a94deab5375d296c02c,07/08/2022,G5a,8566,566,66,LCC,2025-11-15 15:21:56.045,2025-11-15 15:21:56.045,0,2022-08-07
69189a94deab5375d296c04d,07/08/2022,G7c,89,89,89,,2025-11-15 15:21:56.860,2025-11-15 15:21:56.860,0,2022-08-07
69189a94deab5375d296c04a,07/08/2022,G7b,08,08,08,,2025-11-15 15:21:56.789,2025-11-15 15:21:56.789,0,2022-08-07
69189a94deab5375d296c047,07/08/2022,G7a,15,15,15,,2025-11-15 15:21:56.718,2025-11-15 15:21:56.718,0,2022-08-07
69189a94deab5375d296c044,07/08/2022,G6c,708,708,08,LCC,2025-11-15 15:21:56.641,2025-11-15 15:21:56.641,0,2022-08-07
69189a94deab5375d296c041,07/08/2022,G6b,598,598,98,LLC,2025-11-15 15:21:56.550,2025-11-15 15:21:56.550,0,2022-08-07
69189a94deab5375d296c050,07/08/2022,G7d,57,57,57,,2025-11-15 15:21:56.931,2025-11-15 15:21:56.931,0,2022-08-07
69189a94deab5375d296c03b,07/08/2022,G5f,2576,576,76,LLC,2025-11-15 15:21:56.406,2025-11-15 15:21:56.406,0,2022-08-07
69189a94deab5375d296c03e,07/08/2022,G6a,870,870,70,CLC,2025-11-15 15:21:56.478,2025-11-15 15:21:56.478,0,2022-08-07
69189a94deab5375d296c02f,07/08/2022,G5b,5673,673,73,CLL,2025-11-15 15:21:56.117,2025-11-15 15:21:56.117,0,2022-08-07
69189a93deab5375d296c029,07/08/2022,G4d,6999,999,99,LLL,2025-11-15 15:21:55.973,2025-11-15 15:21:55.973,0,2022-08-07
69189a94deab5375d296c035,07/08/2022,G5d,7055,055,55,CLL,2025-11-15 15:21:56.262,2025-11-15 15:21:56.262,0,2022-08-07
69189a94deab5375d296c038,07/08/2022,G5e,8534,534,34,LLC,2025-11-15 15:21:56.334,2025-11-15 15:21:56.334,0,2022-08-07
69189a94deab5375d296c032,07/08/2022,G5c,2593,593,93,LLL,2025-11-15 15:21:56.190,2025-11-15 15:21:56.190,0,2022-08-07
69189a91deab5375d296bfd2,08/08/2022,G4b,3327,327,27,LCL,2025-11-15 15:21:53.883,2025-11-15 15:21:53.883,0,2022-08-08
69189a91deab5375d296bfb1,08/08/2022,ĐB,76821,821,21,CCL,2025-11-15 15:21:53.078,2025-11-15 15:21:53.078,0,2022-08-08
69189a91deab5375d296bfb4,08/08/2022,G1,26769,769,69,LCL,2025-11-15 15:21:53.149,2025-11-15 15:21:53.149,0,2022-08-08
69189a91deab5375d296bfb7,08/08/2022,G2a,25934,934,34,LLC,2025-11-15 15:21:53.221,2025-11-15 15:21:53.221,0,2022-08-08
69189a91deab5375d296bfbd,08/08/2022,G3a,43807,807,07,CCL,2025-11-15 15:21:53.364,2025-11-15 15:21:53.364,0,2022-08-08
69189a91deab5375d296bfc0,08/08/2022,G3b,18207,207,07,CCL,2025-11-15 15:21:53.435,2025-11-15 15:21:53.435,0,2022-08-08
69189a91deab5375d296bfc3,08/08/2022,G3c,37835,835,35,CLL,2025-11-15 15:21:53.506,2025-11-15 15:21:53.506,0,2022-08-08
69189a91deab5375d296bfc6,08/08/2022,G3d,64746,746,46,LCC,2025-11-15 15:21:53.585,2025-11-15 15:21:53.585,0,2022-08-08
69189a91deab5375d296bfc9,08/08/2022,G3e,96956,956,56,LLC,2025-11-15 15:21:53.669,2025-11-15 15:21:53.669,0,2022-08-08
69189a91deab5375d296bfcc,08/08/2022,G3f,71714,714,14,LLC,2025-11-15 15:21:53.740,2025-11-15 15:21:53.740,0,2022-08-08
69189a91deab5375d296bfcf,08/08/2022,G4a,9638,638,38,CLC,2025-11-15 15:21:53.811,2025-11-15 15:21:53.811,0,2022-08-08
69189a91deab5375d296bfba,08/08/2022,G2b,27097,097,97,CLL,2025-11-15 15:21:53.292,2025-11-15 15:21:53.292,0,2022-08-08
69189a91deab5375d296bfd5,08/08/2022,G4c,2771,771,71,LLL,2025-11-15 15:21:53.954,2025-11-15 15:21:53.954,0,2022-08-08
69189a92deab5375d296bfdb,08/08/2022,G5a,5803,803,03,CCL,2025-11-15 15:21:54.097,2025-11-15 15:21:54.097,0,2022-08-08
69189a92deab5375d296bfd8,08/08/2022,G4d,8852,852,52,CLC,2025-11-15 15:21:54.026,2025-11-15 15:21:54.026,0,2022-08-08
69189a92deab5375d296bffc,08/08/2022,G7c,12,12,12,,2025-11-15 15:21:54.887,2025-11-15 15:21:54.887,0,2022-08-08
69189a92deab5375d296bff9,08/08/2022,G7b,15,15,15,,2025-11-15 15:21:54.816,2025-11-15 15:21:54.816,0,2022-08-08
69189a92deab5375d296bff6,08/08/2022,G7a,26,26,26,,2025-11-15 15:21:54.744,2025-11-15 15:21:54.744,0,2022-08-08
69189a92deab5375d296bff3,08/08/2022,G6c,624,624,24,CCC,2025-11-15 15:21:54.671,2025-11-15 15:21:54.671,0,2022-08-08
69189a92deab5375d296bff0,08/08/2022,G6b,716,716,16,LLC,2025-11-15 15:21:54.600,2025-11-15 15:21:54.600,0,2022-08-08
69189a92deab5375d296bfff,08/08/2022,G7d,43,43,43,,2025-11-15 15:21:54.958,2025-11-15 15:21:54.958,0,2022-08-08
69189a92deab5375d296bfea,08/08/2022,G5f,1323,323,23,LCL,2025-11-15 15:21:54.455,2025-11-15 15:21:54.455,0,2022-08-08
69189a92deab5375d296bfe7,08/08/2022,G5e,7592,592,92,LLC,2025-11-15 15:21:54.384,2025-11-15 15:21:54.384,0,2022-08-08
69189a92deab5375d296bfe4,08/08/2022,G5d,8429,429,29,CCL,2025-11-15 15:21:54.312,2025-11-15 15:21:54.312,0,2022-08-08
69189a92deab5375d296bfe1,08/08/2022,G5c,1658,658,58,CLC,2025-11-15 15:21:54.241,2025-11-15 15:21:54.241,0,2022-08-08
69189a92deab5375d296bfde,08/08/2022,G5b,4206,206,06,CCC,2025-11-15 15:21:54.169,2025-11-15 15:21:54.169,0,2022-08-08
69189a92deab5375d296bfed,08/08/2022,G6a,531,531,31,LLL,2025-11-15 15:21:54.527,2025-11-15 15:21:54.527,0,2022-08-08
69189a8fdeab5375d296bf7e,09/08/2022,G4a,2496,496,96,CLC,2025-11-15 15:21:51.855,2025-11-15 15:21:51.855,0,2022-08-09
69189a8fdeab5375d296bf7b,09/08/2022,G3f,86478,478,78,CLC,2025-11-15 15:21:51.784,2025-11-15 15:21:51.784,0,2022-08-09
69189a8fdeab5375d296bf78,09/08/2022,G3e,09071,071,71,CLL,2025-11-15 15:21:51.712,2025-11-15 15:21:51.712,0,2022-08-09
69189a8fdeab5375d296bf75,09/08/2022,G3d,77701,701,01,LCL,2025-11-15 15:21:51.640,2025-11-15 15:21:51.640,0,2022-08-09
69189a8fdeab5375d296bf72,09/08/2022,G3c,22770,770,70,LLC,2025-11-15 15:21:51.568,2025-11-15 15:21:51.568,0,2022-08-09
69189a8fdeab5375d296bf66,09/08/2022,G2a,76858,858,58,CLC,2025-11-15 15:21:51.279,2025-11-15 15:21:51.279,0,2022-08-09
69189a8fdeab5375d296bf69,09/08/2022,G2b,40225,225,25,CCL,2025-11-15 15:21:51.351,2025-11-15 15:21:51.351,0,2022-08-09
69189a8fdeab5375d296bf63,09/08/2022,G1,08818,818,18,CLC,2025-11-15 15:21:51.203,2025-11-15 15:21:51.203,0,2022-08-09
69189a8fdeab5375d296bf60,09/08/2022,ĐB,00180,180,80,LCC,2025-11-15 15:21:51.130,2025-11-15 15:21:51.130,0,2022-08-09
69189a8fdeab5375d296bf81,09/08/2022,G4b,0033,033,33,CLL,2025-11-15 15:21:51.926,2025-11-15 15:21:51.926,0,2022-08-09
69189a8fdeab5375d296bf6c,09/08/2022,G3a,72014,014,14,CLC,2025-11-15 15:21:51.423,2025-11-15 15:21:51.423,0,2022-08-09
69189a8fdeab5375d296bf84,09/08/2022,G4c,3491,491,91,CLL,2025-11-15 15:21:51.997,2025-11-15 15:21:51.997,0,2022-08-09
69189a8fdeab5375d296bf6f,09/08/2022,G3b,12353,353,53,LLL,2025-11-15 15:21:51.495,2025-11-15 15:21:51.495,0,2022-08-09
69189a90deab5375d296bf8a,09/08/2022,G5a,9133,133,33,LLL,2025-11-15 15:21:52.140,2025-11-15 15:21:52.140,0,2022-08-09
69189a90deab5375d296bfab,09/08/2022,G7c,30,30,30,,2025-11-15 15:21:52.934,2025-11-15 15:21:52.934,0,2022-08-09
69189a90deab5375d296bfa8,09/08/2022,G7b,26,26,26,,2025-11-15 15:21:52.863,2025-11-15 15:21:52.863,0,2022-08-09
69189a90deab5375d296bfa5,09/08/2022,G7a,29,29,29,,2025-11-15 15:21:52.791,2025-11-15 15:21:52.791,0,2022-08-09
69189a90deab5375d296bfa2,09/08/2022,G6c,615,615,15,CLL,2025-11-15 15:21:52.720,2025-11-15 15:21:52.720,0,2022-08-09
69189a90deab5375d296bf9f,09/08/2022,G6b,431,431,31,CLL,2025-11-15 15:21:52.648,2025-11-15 15:21:52.648,0,2022-08-09
69189a90deab5375d296bf9c,09/08/2022,G6a,487,487,87,CCL,2025-11-15 15:21:52.576,2025-11-15 15:21:52.576,0,2022-08-09
69189a90deab5375d296bf87,09/08/2022,G4d,3756,756,56,LLC,2025-11-15 15:21:52.068,2025-11-15 15:21:52.068,0,2022-08-09
69189a90deab5375d296bf99,09/08/2022,G5f,6589,589,89,LCL,2025-11-15 15:21:52.504,2025-11-15 15:21:52.504,0,2022-08-09
69189a90deab5375d296bf96,09/08/2022,G5e,4817,817,17,CLL,2025-11-15 15:21:52.433,2025-11-15 15:21:52.433,0,2022-08-09
69189a90deab5375d296bf93,09/08/2022,G5d,7490,490,90,CLC,2025-11-15 15:21:52.361,2025-11-15 15:21:52.361,0,2022-08-09
69189a90deab5375d296bf90,09/08/2022,G5c,9829,829,29,CCL,2025-11-15 15:21:52.290,2025-11-15 15:21:52.290,0,2022-08-09
69189a90deab5375d296bf8d,09/08/2022,G5b,9537,537,37,LLL,2025-11-15 15:21:52.211,2025-11-15 15:21:52.211,0,2022-08-09
69189a91deab5375d296bfae,09/08/2022,G7d,37,37,37,,2025-11-15 15:21:53.006,2025-11-15 15:21:53.006,0,2022-08-09
69189a8ddeab5375d296bf2a,10/08/2022,G3f,55440,440,40,CCC,2025-11-15 15:21:49.830,2025-11-15 15:21:49.830,0,2022-08-10
69189a8ddeab5375d296bf27,10/08/2022,G3e,11281,281,81,CCL,2025-11-15 15:21:49.759,2025-11-15 15:21:49.759,0,2022-08-10
69189a8ddeab5375d296bf24,10/08/2022,G3d,34533,533,33,LLL,2025-11-15 15:21:49.687,2025-11-15 15:21:49.687,0,2022-08-10
69189a8ddeab5375d296bf21,10/08/2022,G3c,16191,191,91,LLL,2025-11-15 15:21:49.615,2025-11-15 15:21:49.615,0,2022-08-10
69189a8ddeab5375d296bf1e,10/08/2022,G3b,94336,336,36,LLC,2025-11-15 15:21:49.544,2025-11-15 15:21:49.544,0,2022-08-10
69189a8ddeab5375d296bf15,10/08/2022,G2a,15689,689,89,CCL,2025-11-15 15:21:49.331,2025-11-15 15:21:49.331,0,2022-08-10
69189a8ddeab5375d296bf18,10/08/2022,G2b,40605,605,05,CCL,2025-11-15 15:21:49.402,2025-11-15 15:21:49.402,0,2022-08-10
69189a8ddeab5375d296bf12,10/08/2022,G1,46227,227,27,CCL,2025-11-15 15:21:49.260,2025-11-15 15:21:49.260,0,2022-08-10
69189a8ddeab5375d296bf0f,10/08/2022,ĐB,42119,119,19,LLL,2025-11-15 15:21:49.188,2025-11-15 15:21:49.188,0,2022-08-10
69189a8ddeab5375d296bf2d,10/08/2022,G4a,3715,715,15,LLL,2025-11-15 15:21:49.902,2025-11-15 15:21:49.902,0,2022-08-10
69189a8ddeab5375d296bf1b,10/08/2022,G3a,72931,931,31,LLL,2025-11-15 15:21:49.474,2025-11-15 15:21:49.474,0,2022-08-10
69189a8ddeab5375d296bf30,10/08/2022,G4b,6243,243,43,CCL,2025-11-15 15:21:49.974,2025-11-15 15:21:49.974,0,2022-08-10
69189a8edeab5375d296bf33,10/08/2022,G4c,8815,815,15,CLL,2025-11-15 15:21:50.047,2025-11-15 15:21:50.047,0,2022-08-10
69189a8edeab5375d296bf36,10/08/2022,G4d,2599,599,99,LLL,2025-11-15 15:21:50.118,2025-11-15 15:21:50.118,0,2022-08-10
69189a8fdeab5375d296bf5d,10/08/2022,G7d,60,60,60,,2025-11-15 15:21:51.058,2025-11-15 15:21:51.058,0,2022-08-10
69189a8edeab5375d296bf57,10/08/2022,G7b,21,21,21,,2025-11-15 15:21:50.914,2025-11-15 15:21:50.914,0,2022-08-10
69189a8edeab5375d296bf54,10/08/2022,G7a,00,00,00,,2025-11-15 15:21:50.842,2025-11-15 15:21:50.842,0,2022-08-10
69189a8edeab5375d296bf51,10/08/2022,G6c,114,114,14,LLC,2025-11-15 15:21:50.770,2025-11-15 15:21:50.770,0,2022-08-10
69189a8edeab5375d296bf4e,10/08/2022,G6b,881,881,81,CCL,2025-11-15 15:21:50.698,2025-11-15 15:21:50.698,0,2022-08-10
69189a8edeab5375d296bf4b,10/08/2022,G6a,480,480,80,CCC,2025-11-15 15:21:50.627,2025-11-15 15:21:50.627,0,2022-08-10
69189a8edeab5375d296bf5a,10/08/2022,G7c,22,22,22,,2025-11-15 15:21:50.986,2025-11-15 15:21:50.986,0,2022-08-10
69189a8edeab5375d296bf45,10/08/2022,G5e,2428,428,28,CCC,2025-11-15 15:21:50.476,2025-11-15 15:21:50.476,0,2022-08-10
69189a8edeab5375d296bf42,10/08/2022,G5d,0050,050,50,CLC,2025-11-15 15:21:50.404,2025-11-15 15:21:50.404,0,2022-08-10
69189a8edeab5375d296bf3f,10/08/2022,G5c,7267,267,67,CCL,2025-11-15 15:21:50.332,2025-11-15 15:21:50.332,0,2022-08-10
69189a8edeab5375d296bf3c,10/08/2022,G5b,5335,335,35,LLL,2025-11-15 15:21:50.261,2025-11-15 15:21:50.261,0,2022-08-10
69189a8edeab5375d296bf39,10/08/2022,G5a,2175,175,75,LLL,2025-11-15 15:21:50.189,2025-11-15 15:21:50.189,0,2022-08-10
69189a8edeab5375d296bf48,10/08/2022,G5f,0823,823,23,CCL,2025-11-15 15:21:50.548,2025-11-15 15:21:50.548,0,2022-08-10
69189a8bdeab5375d296bed9,11/08/2022,G3f,67821,821,21,CCL,2025-11-15 15:21:47.891,2025-11-15 15:21:47.891,0,2022-08-11
69189a8bdeab5375d296bed6,11/08/2022,G3e,05240,240,40,CCC,2025-11-15 15:21:47.819,2025-11-15 15:21:47.819,0,2022-08-11
69189a8bdeab5375d296bed3,11/08/2022,G3d,92026,026,26,CCC,2025-11-15 15:21:47.748,2025-11-15 15:21:47.748,0,2022-08-11
69189a8bdeab5375d296bed0,11/08/2022,G3c,55157,157,57,LLL,2025-11-15 15:21:47.676,2025-11-15 15:21:47.676,0,2022-08-11
69189a8bdeab5375d296becd,11/08/2022,G3b,43808,808,08,CCC,2025-11-15 15:21:47.603,2025-11-15 15:21:47.603,0,2022-08-11
69189a8bdeab5375d296bec4,11/08/2022,G2a,92964,964,64,LCC,2025-11-15 15:21:47.387,2025-11-15 15:21:47.387,0,2022-08-11
69189a8bdeab5375d296bec7,11/08/2022,G2b,99837,837,37,CLL,2025-11-15 15:21:47.460,2025-11-15 15:21:47.460,0,2022-08-11
69189a8bdeab5375d296bec1,11/08/2022,G1,54663,663,63,CCL,2025-11-15 15:21:47.316,2025-11-15 15:21:47.316,0,2022-08-11
69189a8bdeab5375d296bebe,11/08/2022,ĐB,44082,082,82,CCC,2025-11-15 15:21:47.244,2025-11-15 15:21:47.244,0,2022-08-11
69189a8bdeab5375d296bedc,11/08/2022,G4a,2738,738,38,LLC,2025-11-15 15:21:47.962,2025-11-15 15:21:47.962,0,2022-08-11
69189a8bdeab5375d296beca,11/08/2022,G3a,22054,054,54,CLC,2025-11-15 15:21:47.531,2025-11-15 15:21:47.531,0,2022-08-11
69189a8cdeab5375d296bedf,11/08/2022,G4b,7721,721,21,LCL,2025-11-15 15:21:48.033,2025-11-15 15:21:48.033,0,2022-08-11
69189a8ddeab5375d296bf0c,11/08/2022,G7d,97,97,97,,2025-11-15 15:21:49.115,2025-11-15 15:21:49.115,0,2022-08-11
69189a8cdeab5375d296bee5,11/08/2022,G4d,8774,774,74,LLC,2025-11-15 15:21:48.178,2025-11-15 15:21:48.178,0,2022-08-11
69189a8cdeab5375d296bee2,11/08/2022,G4c,9324,324,24,LCC,2025-11-15 15:21:48.105,2025-11-15 15:21:48.105,0,2022-08-11
69189a8cdeab5375d296bf06,11/08/2022,G7b,50,50,50,,2025-11-15 15:21:48.972,2025-11-15 15:21:48.972,0,2022-08-11
69189a8cdeab5375d296bf03,11/08/2022,G7a,18,18,18,,2025-11-15 15:21:48.900,2025-11-15 15:21:48.900,0,2022-08-11
69189a8cdeab5375d296bf00,11/08/2022,G6c,344,344,44,LCC,2025-11-15 15:21:48.829,2025-11-15 15:21:48.829,0,2022-08-11
69189a8cdeab5375d296befd,11/08/2022,G6b,573,573,73,LLL,2025-11-15 15:21:48.757,2025-11-15 15:21:48.757,0,2022-08-11
69189a8cdeab5375d296befa,11/08/2022,G6a,222,222,22,CCC,2025-11-15 15:21:48.685,2025-11-15 15:21:48.685,0,2022-08-11
69189a8ddeab5375d296bf09,11/08/2022,G7c,01,01,01,,2025-11-15 15:21:49.044,2025-11-15 15:21:49.044,0,2022-08-11
69189a8cdeab5375d296bef4,11/08/2022,G5e,6552,552,52,LLC,2025-11-15 15:21:48.541,2025-11-15 15:21:48.541,0,2022-08-11
69189a8cdeab5375d296bef1,11/08/2022,G5d,6678,678,78,CLC,2025-11-15 15:21:48.469,2025-11-15 15:21:48.469,0,2022-08-11
69189a8cdeab5375d296beee,11/08/2022,G5c,0851,851,51,CLL,2025-11-15 15:21:48.398,2025-11-15 15:21:48.398,0,2022-08-11
69189a8cdeab5375d296beeb,11/08/2022,G5b,5523,523,23,LCL,2025-11-15 15:21:48.326,2025-11-15 15:21:48.326,0,2022-08-11
69189a8cdeab5375d296bee8,11/08/2022,G5a,9294,294,94,CLC,2025-11-15 15:21:48.254,2025-11-15 15:21:48.254,0,2022-08-11
69189a8cdeab5375d296bef7,11/08/2022,G5f,6797,797,97,LLL,2025-11-15 15:21:48.614,2025-11-15 15:21:48.614,0,2022-08-11
69189a89deab5375d296be88,12/08/2022,G3f,71697,697,97,CLL,2025-11-15 15:21:45.956,2025-11-15 15:21:45.956,0,2022-08-12
69189a89deab5375d296be85,12/08/2022,G3e,55906,906,06,LCC,2025-11-15 15:21:45.876,2025-11-15 15:21:45.876,0,2022-08-12
69189a89deab5375d296be82,12/08/2022,G3d,74037,037,37,CLL,2025-11-15 15:21:45.804,2025-11-15 15:21:45.804,0,2022-08-12
69189a89deab5375d296be7f,12/08/2022,G3c,72392,392,92,LLC,2025-11-15 15:21:45.732,2025-11-15 15:21:45.732,0,2022-08-12
69189a89deab5375d296be7c,12/08/2022,G3b,82224,224,24,CCC,2025-11-15 15:21:45.660,2025-11-15 15:21:45.660,0,2022-08-12
69189a89deab5375d296be73,12/08/2022,G2a,73740,740,40,LCC,2025-11-15 15:21:45.444,2025-11-15 15:21:45.444,0,2022-08-12
69189a89deab5375d296be76,12/08/2022,G2b,91882,882,82,CCC,2025-11-15 15:21:45.516,2025-11-15 15:21:45.516,0,2022-08-12
69189a89deab5375d296be70,12/08/2022,G1,42956,956,56,LLC,2025-11-15 15:21:45.373,2025-11-15 15:21:45.373,0,2022-08-12
69189a89deab5375d296be6d,12/08/2022,ĐB,93970,970,70,LLC,2025-11-15 15:21:45.302,2025-11-15 15:21:45.302,0,2022-08-12
69189a8adeab5375d296be8b,12/08/2022,G4a,8776,776,76,LLC,2025-11-15 15:21:46.027,2025-11-15 15:21:46.027,0,2022-08-12
69189a89deab5375d296be79,12/08/2022,G3a,83289,289,89,CCL,2025-11-15 15:21:45.588,2025-11-15 15:21:45.588,0,2022-08-12
69189a8adeab5375d296be8e,12/08/2022,G4b,4418,418,18,CLC,2025-11-15 15:21:46.099,2025-11-15 15:21:46.099,0,2022-08-12
69189a8bdeab5375d296bebb,12/08/2022,G7d,72,72,72,,2025-11-15 15:21:47.173,2025-11-15 15:21:47.173,0,2022-08-12
69189a8adeab5375d296be94,12/08/2022,G4d,8959,959,59,LLL,2025-11-15 15:21:46.243,2025-11-15 15:21:46.243,0,2022-08-12
69189a8bdeab5375d296beb5,12/08/2022,G7b,90,90,90,,2025-11-15 15:21:47.029,2025-11-15 15:21:47.029,0,2022-08-12
69189a8adeab5375d296beb2,12/08/2022,G7a,19,19,19,,2025-11-15 15:21:46.958,2025-11-15 15:21:46.958,0,2022-08-12
69189a8adeab5375d296beaf,12/08/2022,G6c,067,067,67,CCL,2025-11-15 15:21:46.887,2025-11-15 15:21:46.887,0,2022-08-12
69189a8adeab5375d296beac,12/08/2022,G6b,686,686,86,CCC,2025-11-15 15:21:46.815,2025-11-15 15:21:46.815,0,2022-08-12
69189a8adeab5375d296bea9,12/08/2022,G6a,821,821,21,CCL,2025-11-15 15:21:46.744,2025-11-15 15:21:46.744,0,2022-08-12
69189a8bdeab5375d296beb8,12/08/2022,G7c,38,38,38,,2025-11-15 15:21:47.102,2025-11-15 15:21:47.102,0,2022-08-12
69189a8adeab5375d296bea3,12/08/2022,G5e,9050,050,50,CLC,2025-11-15 15:21:46.600,2025-11-15 15:21:46.600,0,2022-08-12
69189a8adeab5375d296bea6,12/08/2022,G5f,2909,909,09,LCL,2025-11-15 15:21:46.673,2025-11-15 15:21:46.673,0,2022-08-12
69189a8adeab5375d296be97,12/08/2022,G5a,1169,169,69,LCL,2025-11-15 15:21:46.314,2025-11-15 15:21:46.314,0,2022-08-12
69189a8adeab5375d296be91,12/08/2022,G4c,7445,445,45,CCL,2025-11-15 15:21:46.171,2025-11-15 15:21:46.171,0,2022-08-12
69189a8adeab5375d296be9d,12/08/2022,G5c,5630,630,30,CLC,2025-11-15 15:21:46.457,2025-11-15 15:21:46.457,0,2022-08-12
69189a8adeab5375d296bea0,12/08/2022,G5d,9231,231,31,CLL,2025-11-15 15:21:46.529,2025-11-15 15:21:46.529,0,2022-08-12
69189a8adeab5375d296be9a,12/08/2022,G5b,0666,666,66,CCC,2025-11-15 15:21:46.386,2025-11-15 15:21:46.386,0,2022-08-12
69189a88deab5375d296be3d,13/08/2022,G4b,2636,636,36,CLC,2025-11-15 15:21:44.132,2025-11-15 15:21:44.132,0,2022-08-13
69189a87deab5375d296be1c,13/08/2022,ĐB,40306,306,06,LCC,2025-11-15 15:21:43.344,2025-11-15 15:21:43.344,0,2022-08-13
69189a87deab5375d296be1f,13/08/2022,G1,29373,373,73,LLL,2025-11-15 15:21:43.415,2025-11-15 15:21:43.415,0,2022-08-13
69189a87deab5375d296be22,13/08/2022,G2a,24629,629,29,CCL,2025-11-15 15:21:43.486,2025-11-15 15:21:43.486,0,2022-08-13
69189a87deab5375d296be28,13/08/2022,G3a,71646,646,46,CCC,2025-11-15 15:21:43.629,2025-11-15 15:21:43.629,0,2022-08-13
69189a87deab5375d296be2b,13/08/2022,G3b,95478,478,78,CLC,2025-11-15 15:21:43.700,2025-11-15 15:21:43.700,0,2022-08-13
69189a87deab5375d296be2e,13/08/2022,G3c,96243,243,43,CCL,2025-11-15 15:21:43.772,2025-11-15 15:21:43.772,0,2022-08-13
69189a87deab5375d296be31,13/08/2022,G3d,76243,243,43,CCL,2025-11-15 15:21:43.844,2025-11-15 15:21:43.844,0,2022-08-13
69189a87deab5375d296be34,13/08/2022,G3e,78047,047,47,CCL,2025-11-15 15:21:43.915,2025-11-15 15:21:43.915,0,2022-08-13
69189a87deab5375d296be37,13/08/2022,G3f,19705,705,05,LCL,2025-11-15 15:21:43.986,2025-11-15 15:21:43.986,0,2022-08-13
69189a88deab5375d296be3a,13/08/2022,G4a,0851,851,51,CLL,2025-11-15 15:21:44.060,2025-11-15 15:21:44.060,0,2022-08-13
69189a87deab5375d296be25,13/08/2022,G2b,41347,347,47,LCL,2025-11-15 15:21:43.558,2025-11-15 15:21:43.558,0,2022-08-13
69189a88deab5375d296be40,13/08/2022,G4c,5859,859,59,CLL,2025-11-15 15:21:44.204,2025-11-15 15:21:44.204,0,2022-08-13
69189a88deab5375d296be46,13/08/2022,G5a,6873,873,73,CLL,2025-11-15 15:21:44.347,2025-11-15 15:21:44.347,0,2022-08-13
69189a88deab5375d296be43,13/08/2022,G4d,6514,514,14,LLC,2025-11-15 15:21:44.275,2025-11-15 15:21:44.275,0,2022-08-13
69189a89deab5375d296be67,13/08/2022,G7c,26,26,26,,2025-11-15 15:21:45.157,2025-11-15 15:21:45.157,0,2022-08-13
69189a89deab5375d296be64,13/08/2022,G7b,88,88,88,,2025-11-15 15:21:45.086,2025-11-15 15:21:45.086,0,2022-08-13
69189a89deab5375d296be61,13/08/2022,G7a,75,75,75,,2025-11-15 15:21:45.008,2025-11-15 15:21:45.008,0,2022-08-13
69189a88deab5375d296be5e,13/08/2022,G6c,566,566,66,LCC,2025-11-15 15:21:44.937,2025-11-15 15:21:44.937,0,2022-08-13
69189a88deab5375d296be5b,13/08/2022,G6b,615,615,15,CLL,2025-11-15 15:21:44.865,2025-11-15 15:21:44.865,0,2022-08-13
69189a89deab5375d296be6a,13/08/2022,G7d,34,34,34,,2025-11-15 15:21:45.229,2025-11-15 15:21:45.229,0,2022-08-13
69189a88deab5375d296be55,13/08/2022,G5f,1699,699,99,CLL,2025-11-15 15:21:44.723,2025-11-15 15:21:44.723,0,2022-08-13
69189a88deab5375d296be52,13/08/2022,G5e,8160,160,60,LCC,2025-11-15 15:21:44.652,2025-11-15 15:21:44.652,0,2022-08-13
69189a88deab5375d296be4f,13/08/2022,G5d,6666,666,66,CCC,2025-11-15 15:21:44.580,2025-11-15 15:21:44.580,0,2022-08-13
69189a88deab5375d296be4c,13/08/2022,G5c,3430,430,30,CLC,2025-11-15 15:21:44.508,2025-11-15 15:21:44.508,0,2022-08-13
69189a88deab5375d296be49,13/08/2022,G5b,5940,940,40,LCC,2025-11-15 15:21:44.436,2025-11-15 15:21:44.436,0,2022-08-13
69189a88deab5375d296be58,13/08/2022,G6a,731,731,31,LLL,2025-11-15 15:21:44.794,2025-11-15 15:21:44.794,0,2022-08-13
69189a86deab5375d296bde6,14/08/2022,G3f,69804,804,04,CCC,2025-11-15 15:21:42.039,2025-11-15 15:21:42.039,0,2022-08-14
69189a85deab5375d296bde3,14/08/2022,G3e,26295,295,95,CLL,2025-11-15 15:21:41.967,2025-11-15 15:21:41.967,0,2022-08-14
69189a85deab5375d296bde0,14/08/2022,G3d,76131,131,31,LLL,2025-11-15 15:21:41.896,2025-11-15 15:21:41.896,0,2022-08-14
69189a85deab5375d296bddd,14/08/2022,G3c,21524,524,24,LCC,2025-11-15 15:21:41.824,2025-11-15 15:21:41.824,0,2022-08-14
69189a85deab5375d296bdda,14/08/2022,G3b,28353,353,53,LLL,2025-11-15 15:21:41.752,2025-11-15 15:21:41.752,0,2022-08-14
69189a85deab5375d296bdd1,14/08/2022,G2a,12663,663,63,CCL,2025-11-15 15:21:41.537,2025-11-15 15:21:41.537,0,2022-08-14
69189a85deab5375d296bdd4,14/08/2022,G2b,03126,126,26,LCC,2025-11-15 15:21:41.608,2025-11-15 15:21:41.608,0,2022-08-14
69189a85deab5375d296bdce,14/08/2022,G1,96091,091,91,CLL,2025-11-15 15:21:41.466,2025-11-15 15:21:41.466,0,2022-08-14
69189a85deab5375d296bdcb,14/08/2022,ĐB,90213,213,13,CLL,2025-11-15 15:21:41.394,2025-11-15 15:21:41.394,0,2022-08-14
69189a86deab5375d296bde9,14/08/2022,G4a,3374,374,74,LLC,2025-11-15 15:21:42.112,2025-11-15 15:21:42.112,0,2022-08-14
69189a85deab5375d296bdd7,14/08/2022,G3a,96299,299,99,CLL,2025-11-15 15:21:41.680,2025-11-15 15:21:41.680,0,2022-08-14
69189a86deab5375d296bdec,14/08/2022,G4b,8195,195,95,LLL,2025-11-15 15:21:42.183,2025-11-15 15:21:42.183,0,2022-08-14
69189a86deab5375d296bdef,14/08/2022,G4c,2463,463,63,CCL,2025-11-15 15:21:42.264,2025-11-15 15:21:42.264,0,2022-08-14
69189a86deab5375d296bdf2,14/08/2022,G4d,7621,621,21,CCL,2025-11-15 15:21:42.334,2025-11-15 15:21:42.334,0,2022-08-14
69189a87deab5375d296be16,14/08/2022,G7c,89,89,89,,2025-11-15 15:21:43.202,2025-11-15 15:21:43.202,0,2022-08-14
69189a87deab5375d296be13,14/08/2022,G7b,75,75,75,,2025-11-15 15:21:43.130,2025-11-15 15:21:43.130,0,2022-08-14
69189a87deab5375d296be10,14/08/2022,G7a,74,74,74,,2025-11-15 15:21:43.057,2025-11-15 15:21:43.057,0,2022-08-14
69189a86deab5375d296be0d,14/08/2022,G6c,689,689,89,CCL,2025-11-15 15:21:42.984,2025-11-15 15:21:42.984,0,2022-08-14
69189a86deab5375d296be0a,14/08/2022,G6b,703,703,03,LCL,2025-11-15 15:21:42.913,2025-11-15 15:21:42.913,0,2022-08-14
69189a86deab5375d296be07,14/08/2022,G6a,134,134,34,LLC,2025-11-15 15:21:42.841,2025-11-15 15:21:42.841,0,2022-08-14
69189a87deab5375d296be19,14/08/2022,G7d,06,06,06,,2025-11-15 15:21:43.273,2025-11-15 15:21:43.273,0,2022-08-14
69189a86deab5375d296be01,14/08/2022,G5e,0607,607,07,CCL,2025-11-15 15:21:42.698,2025-11-15 15:21:42.698,0,2022-08-14
69189a86deab5375d296bdfe,14/08/2022,G5d,3256,256,56,CLC,2025-11-15 15:21:42.624,2025-11-15 15:21:42.624,0,2022-08-14
69189a86deab5375d296bdfb,14/08/2022,G5c,2244,244,44,CCC,2025-11-15 15:21:42.551,2025-11-15 15:21:42.551,0,2022-08-14
69189a86deab5375d296bdf8,14/08/2022,G5b,0768,768,68,LCC,2025-11-15 15:21:42.478,2025-11-15 15:21:42.478,0,2022-08-14
69189a86deab5375d296bdf5,14/08/2022,G5a,8622,622,22,CCC,2025-11-15 15:21:42.406,2025-11-15 15:21:42.406,0,2022-08-14
69189a86deab5375d296be04,14/08/2022,G5f,5253,253,53,CLL,2025-11-15 15:21:42.769,2025-11-15 15:21:42.769,0,2022-08-14
69189a84deab5375d296bd95,15/08/2022,G3f,66134,134,34,LLC,2025-11-15 15:21:40.098,2025-11-15 15:21:40.098,0,2022-08-15
69189a84deab5375d296bd92,15/08/2022,G3e,31743,743,43,LCL,2025-11-15 15:21:40.026,2025-11-15 15:21:40.026,0,2022-08-15
69189a83deab5375d296bd8f,15/08/2022,G3d,09993,993,93,LLL,2025-11-15 15:21:39.953,2025-11-15 15:21:39.953,0,2022-08-15
69189a83deab5375d296bd8c,15/08/2022,G3c,57517,517,17,LLL,2025-11-15 15:21:39.882,2025-11-15 15:21:39.882,0,2022-08-15
69189a83deab5375d296bd89,15/08/2022,G3b,52091,091,91,CLL,2025-11-15 15:21:39.810,2025-11-15 15:21:39.810,0,2022-08-15
69189a83deab5375d296bd80,15/08/2022,G2a,27002,002,02,CCC,2025-11-15 15:21:39.594,2025-11-15 15:21:39.594,0,2022-08-15
69189a83deab5375d296bd83,15/08/2022,G2b,45812,812,12,CLC,2025-11-15 15:21:39.666,2025-11-15 15:21:39.666,0,2022-08-15
69189a83deab5375d296bd7d,15/08/2022,G1,51486,486,86,CCC,2025-11-15 15:21:39.523,2025-11-15 15:21:39.523,0,2022-08-15
69189a83deab5375d296bd7a,15/08/2022,ĐB,19117,117,17,LLL,2025-11-15 15:21:39.451,2025-11-15 15:21:39.451,0,2022-08-15
69189a84deab5375d296bd98,15/08/2022,G4a,4783,783,83,LCL,2025-11-15 15:21:40.171,2025-11-15 15:21:40.171,0,2022-08-15
69189a83deab5375d296bd86,15/08/2022,G3a,22224,224,24,CCC,2025-11-15 15:21:39.738,2025-11-15 15:21:39.738,0,2022-08-15
69189a84deab5375d296bd9b,15/08/2022,G4b,1074,074,74,CLC,2025-11-15 15:21:40.243,2025-11-15 15:21:40.243,0,2022-08-15
69189a84deab5375d296bd9e,15/08/2022,G4c,4928,928,28,LCC,2025-11-15 15:21:40.316,2025-11-15 15:21:40.316,0,2022-08-15
69189a84deab5375d296bda1,15/08/2022,G4d,0171,171,71,LLL,2025-11-15 15:21:40.389,2025-11-15 15:21:40.389,0,2022-08-15
69189a85deab5375d296bdc8,15/08/2022,G7d,57,57,57,,2025-11-15 15:21:41.323,2025-11-15 15:21:41.323,0,2022-08-15
69189a85deab5375d296bdc2,15/08/2022,G7b,67,67,67,,2025-11-15 15:21:41.179,2025-11-15 15:21:41.179,0,2022-08-15
69189a85deab5375d296bdbf,15/08/2022,G7a,16,16,16,,2025-11-15 15:21:41.108,2025-11-15 15:21:41.108,0,2022-08-15
69189a85deab5375d296bdbc,15/08/2022,G6c,535,535,35,LLL,2025-11-15 15:21:41.036,2025-11-15 15:21:41.036,0,2022-08-15
69189a84deab5375d296bdb9,15/08/2022,G6b,533,533,33,LLL,2025-11-15 15:21:40.963,2025-11-15 15:21:40.963,0,2022-08-15
69189a84deab5375d296bdb6,15/08/2022,G6a,313,313,13,LLL,2025-11-15 15:21:40.891,2025-11-15 15:21:40.891,0,2022-08-15
69189a85deab5375d296bdc5,15/08/2022,G7c,93,93,93,,2025-11-15 15:21:41.251,2025-11-15 15:21:41.251,0,2022-08-15
69189a84deab5375d296bdb0,15/08/2022,G5e,0207,207,07,CCL,2025-11-15 15:21:40.747,2025-11-15 15:21:40.747,0,2022-08-15
69189a84deab5375d296bdad,15/08/2022,G5d,7825,825,25,CCL,2025-11-15 15:21:40.676,2025-11-15 15:21:40.676,0,2022-08-15
69189a84deab5375d296bdaa,15/08/2022,G5c,9917,917,17,LLL,2025-11-15 15:21:40.603,2025-11-15 15:21:40.603,0,2022-08-15
69189a84deab5375d296bda7,15/08/2022,G5b,7431,431,31,CLL,2025-11-15 15:21:40.532,2025-11-15 15:21:40.532,0,2022-08-15
69189a84deab5375d296bda4,15/08/2022,G5a,0247,247,47,CCL,2025-11-15 15:21:40.460,2025-11-15 15:21:40.460,0,2022-08-15
69189a84deab5375d296bdb3,15/08/2022,G5f,5207,207,07,CCL,2025-11-15 15:21:40.819,2025-11-15 15:21:40.819,0,2022-08-15
69189a82deab5375d296bd44,16/08/2022,G3f,60174,174,74,LLC,2025-11-15 15:21:38.168,2025-11-15 15:21:38.168,0,2022-08-16
69189a82deab5375d296bd41,16/08/2022,G3e,11430,430,30,CLC,2025-11-15 15:21:38.097,2025-11-15 15:21:38.097,0,2022-08-16
69189a82deab5375d296bd3e,16/08/2022,G3d,84872,872,72,CLC,2025-11-15 15:21:38.026,2025-11-15 15:21:38.026,0,2022-08-16
69189a81deab5375d296bd3b,16/08/2022,G3c,12692,692,92,CLC,2025-11-15 15:21:37.955,2025-11-15 15:21:37.955,0,2022-08-16
69189a81deab5375d296bd38,16/08/2022,G3b,64066,066,66,CCC,2025-11-15 15:21:37.883,2025-11-15 15:21:37.883,0,2022-08-16
69189a81deab5375d296bd2f,16/08/2022,G2a,68041,041,41,CCL,2025-11-15 15:21:37.670,2025-11-15 15:21:37.670,0,2022-08-16
69189a81deab5375d296bd32,16/08/2022,G2b,20939,939,39,LLL,2025-11-15 15:21:37.741,2025-11-15 15:21:37.741,0,2022-08-16
69189a81deab5375d296bd2c,16/08/2022,G1,06952,952,52,LLC,2025-11-15 15:21:37.598,2025-11-15 15:21:37.598,0,2022-08-16
69189a81deab5375d296bd29,16/08/2022,ĐB,05904,904,04,LCC,2025-11-15 15:21:37.525,2025-11-15 15:21:37.525,0,2022-08-16
69189a82deab5375d296bd47,16/08/2022,G4a,2899,899,99,CLL,2025-11-15 15:21:38.239,2025-11-15 15:21:38.239,0,2022-08-16
69189a81deab5375d296bd35,16/08/2022,G3a,60378,378,78,LLC,2025-11-15 15:21:37.812,2025-11-15 15:21:37.812,0,2022-08-16
69189a82deab5375d296bd4a,16/08/2022,G4b,1421,421,21,CCL,2025-11-15 15:21:38.310,2025-11-15 15:21:38.310,0,2022-08-16
69189a83deab5375d296bd77,16/08/2022,G7d,14,14,14,,2025-11-15 15:21:39.380,2025-11-15 15:21:39.380,0,2022-08-16
69189a82deab5375d296bd50,16/08/2022,G4d,6106,106,06,LCC,2025-11-15 15:21:38.451,2025-11-15 15:21:38.451,0,2022-08-16
69189a82deab5375d296bd4d,16/08/2022,G4c,4333,333,33,LLL,2025-11-15 15:21:38.381,2025-11-15 15:21:38.381,0,2022-08-16
69189a83deab5375d296bd71,16/08/2022,G7b,83,83,83,,2025-11-15 15:21:39.238,2025-11-15 15:21:39.238,0,2022-08-16
69189a83deab5375d296bd6e,16/08/2022,G7a,42,42,42,,2025-11-15 15:21:39.167,2025-11-15 15:21:39.167,0,2022-08-16
69189a83deab5375d296bd6b,16/08/2022,G6c,320,320,20,LCC,2025-11-15 15:21:39.096,2025-11-15 15:21:39.096,0,2022-08-16
69189a83deab5375d296bd68,16/08/2022,G6b,529,529,29,LCL,2025-11-15 15:21:39.024,2025-11-15 15:21:39.024,0,2022-08-16
69189a82deab5375d296bd65,16/08/2022,G6a,609,609,09,CCL,2025-11-15 15:21:38.952,2025-11-15 15:21:38.952,0,2022-08-16
69189a83deab5375d296bd74,16/08/2022,G7c,05,05,05,,2025-11-15 15:21:39.309,2025-11-15 15:21:39.309,0,2022-08-16
69189a82deab5375d296bd5f,16/08/2022,G5e,0546,546,46,LCC,2025-11-15 15:21:38.809,2025-11-15 15:21:38.809,0,2022-08-16
69189a82deab5375d296bd5c,16/08/2022,G5d,5878,878,78,CLC,2025-11-15 15:21:38.737,2025-11-15 15:21:38.737,0,2022-08-16
69189a82deab5375d296bd59,16/08/2022,G5c,7045,045,45,CCL,2025-11-15 15:21:38.666,2025-11-15 15:21:38.666,0,2022-08-16
69189a82deab5375d296bd56,16/08/2022,G5b,4857,857,57,CLL,2025-11-15 15:21:38.594,2025-11-15 15:21:38.594,0,2022-08-16
69189a82deab5375d296bd53,16/08/2022,G5a,2708,708,08,LCC,2025-11-15 15:21:38.523,2025-11-15 15:21:38.523,0,2022-08-16
69189a82deab5375d296bd62,16/08/2022,G5f,5721,721,21,LCL,2025-11-15 15:21:38.881,2025-11-15 15:21:38.881,0,2022-08-16
69189a80deab5375d296bcf3,17/08/2022,G3f,19870,870,70,CLC,2025-11-15 15:21:36.220,2025-11-15 15:21:36.220,0,2022-08-17
69189a80deab5375d296bcf0,17/08/2022,G3e,45989,989,89,LCL,2025-11-15 15:21:36.148,2025-11-15 15:21:36.148,0,2022-08-17
69189a80deab5375d296bced,17/08/2022,G3d,83461,461,61,CCL,2025-11-15 15:21:36.077,2025-11-15 15:21:36.077,0,2022-08-17
69189a80deab5375d296bcea,17/08/2022,G3c,02948,948,48,LCC,2025-11-15 15:21:36.002,2025-11-15 15:21:36.002,0,2022-08-17
69189a7fdeab5375d296bce7,17/08/2022,G3b,00280,280,80,CCC,2025-11-15 15:21:35.930,2025-11-15 15:21:35.930,0,2022-08-17
69189a7fdeab5375d296bcde,17/08/2022,G2a,61233,233,33,CLL,2025-11-15 15:21:35.712,2025-11-15 15:21:35.712,0,2022-08-17
69189a7fdeab5375d296bce1,17/08/2022,G2b,03985,985,85,LCL,2025-11-15 15:21:35.784,2025-11-15 15:21:35.784,0,2022-08-17
69189a7fdeab5375d296bcdb,17/08/2022,G1,38978,978,78,LLC,2025-11-15 15:21:35.640,2025-11-15 15:21:35.640,0,2022-08-17
69189a7fdeab5375d296bcd8,17/08/2022,ĐB,54182,182,82,LCC,2025-11-15 15:21:35.570,2025-11-15 15:21:35.570,0,2022-08-17
69189a80deab5375d296bcf6,17/08/2022,G4a,7884,884,84,CCC,2025-11-15 15:21:36.293,2025-11-15 15:21:36.293,0,2022-08-17
69189a7fdeab5375d296bce4,17/08/2022,G3a,41334,334,34,LLC,2025-11-15 15:21:35.859,2025-11-15 15:21:35.859,0,2022-08-17
69189a80deab5375d296bcf9,17/08/2022,G4b,5634,634,34,CLC,2025-11-15 15:21:36.364,2025-11-15 15:21:36.364,0,2022-08-17
69189a81deab5375d296bd26,17/08/2022,G7d,91,91,91,,2025-11-15 15:21:37.451,2025-11-15 15:21:37.451,0,2022-08-17
69189a80deab5375d296bcff,17/08/2022,G4d,8078,078,78,CLC,2025-11-15 15:21:36.508,2025-11-15 15:21:36.508,0,2022-08-17
69189a81deab5375d296bd20,17/08/2022,G7b,04,04,04,,2025-11-15 15:21:37.299,2025-11-15 15:21:37.299,0,2022-08-17
69189a81deab5375d296bd1d,17/08/2022,G7a,26,26,26,,2025-11-15 15:21:37.227,2025-11-15 15:21:37.227,0,2022-08-17
69189a81deab5375d296bd1a,17/08/2022,G6c,601,601,01,CCL,2025-11-15 15:21:37.154,2025-11-15 15:21:37.154,0,2022-08-17
69189a81deab5375d296bd17,17/08/2022,G6b,390,390,90,LLC,2025-11-15 15:21:37.082,2025-11-15 15:21:37.082,0,2022-08-17
69189a81deab5375d296bd14,17/08/2022,G6a,976,976,76,LLC,2025-11-15 15:21:37.009,2025-11-15 15:21:37.009,0,2022-08-17
69189a81deab5375d296bd23,17/08/2022,G7c,40,40,40,,2025-11-15 15:21:37.372,2025-11-15 15:21:37.372,0,2022-08-17
69189a80deab5375d296bd0e,17/08/2022,G5e,5845,845,45,CCL,2025-11-15 15:21:36.866,2025-11-15 15:21:36.866,0,2022-08-17
69189a80deab5375d296bd11,17/08/2022,G5f,0888,888,88,CCC,2025-11-15 15:21:36.938,2025-11-15 15:21:36.938,0,2022-08-17
69189a80deab5375d296bd02,17/08/2022,G5a,9995,995,95,LLL,2025-11-15 15:21:36.579,2025-11-15 15:21:36.579,0,2022-08-17
69189a80deab5375d296bcfc,17/08/2022,G4c,5103,103,03,LCL,2025-11-15 15:21:36.436,2025-11-15 15:21:36.436,0,2022-08-17
69189a80deab5375d296bd08,17/08/2022,G5c,4432,432,32,CLC,2025-11-15 15:21:36.723,2025-11-15 15:21:36.723,0,2022-08-17
69189a80deab5375d296bd0b,17/08/2022,G5d,5354,354,54,LLC,2025-11-15 15:21:36.795,2025-11-15 15:21:36.795,0,2022-08-17
69189a80deab5375d296bd05,17/08/2022,G5b,1114,114,14,LLC,2025-11-15 15:21:36.651,2025-11-15 15:21:36.651,0,2022-08-17
69189a7edeab5375d296bca8,18/08/2022,G4b,7173,173,73,LLL,2025-11-15 15:21:34.421,2025-11-15 15:21:34.421,0,2022-08-18
69189a7ddeab5375d296bc87,18/08/2022,ĐB,92993,993,93,LLL,2025-11-15 15:21:33.624,2025-11-15 15:21:33.624,0,2022-08-18
69189a7ddeab5375d296bc8a,18/08/2022,G1,46562,562,62,LCC,2025-11-15 15:21:33.695,2025-11-15 15:21:33.695,0,2022-08-18
69189a7ddeab5375d296bc8d,18/08/2022,G2a,68475,475,75,CLL,2025-11-15 15:21:33.766,2025-11-15 15:21:33.766,0,2022-08-18
69189a7ddeab5375d296bc93,18/08/2022,G3a,79028,028,28,CCC,2025-11-15 15:21:33.908,2025-11-15 15:21:33.908,0,2022-08-18
69189a7ddeab5375d296bc96,18/08/2022,G3b,40725,725,25,LCL,2025-11-15 15:21:33.979,2025-11-15 15:21:33.979,0,2022-08-18
69189a7edeab5375d296bc99,18/08/2022,G3c,23685,685,85,CCL,2025-11-15 15:21:34.050,2025-11-15 15:21:34.050,0,2022-08-18
69189a7edeab5375d296bc9c,18/08/2022,G3d,37742,742,42,LCC,2025-11-15 15:21:34.121,2025-11-15 15:21:34.121,0,2022-08-18
69189a7edeab5375d296bc9f,18/08/2022,G3e,80014,014,14,CLC,2025-11-15 15:21:34.193,2025-11-15 15:21:34.193,0,2022-08-18
69189a7edeab5375d296bca2,18/08/2022,G3f,55460,460,60,CCC,2025-11-15 15:21:34.265,2025-11-15 15:21:34.265,0,2022-08-18
69189a7edeab5375d296bca5,18/08/2022,G4a,6168,168,68,LCC,2025-11-15 15:21:34.338,2025-11-15 15:21:34.338,0,2022-08-18
69189a7ddeab5375d296bc90,18/08/2022,G2b,79592,592,92,LLC,2025-11-15 15:21:33.837,2025-11-15 15:21:33.837,0,2022-08-18
69189a7edeab5375d296bcab,18/08/2022,G4c,8075,075,75,CLL,2025-11-15 15:21:34.500,2025-11-15 15:21:34.500,0,2022-08-18
69189a7edeab5375d296bcb1,18/08/2022,G5a,8775,775,75,LLL,2025-11-15 15:21:34.642,2025-11-15 15:21:34.642,0,2022-08-18
69189a7edeab5375d296bcae,18/08/2022,G4d,2828,828,28,CCC,2025-11-15 15:21:34.571,2025-11-15 15:21:34.571,0,2022-08-18
69189a7fdeab5375d296bcd2,18/08/2022,G7c,87,87,87,,2025-11-15 15:21:35.427,2025-11-15 15:21:35.427,0,2022-08-18
69189a7fdeab5375d296bccf,18/08/2022,G7b,86,86,86,,2025-11-15 15:21:35.355,2025-11-15 15:21:35.355,0,2022-08-18
69189a7fdeab5375d296bccc,18/08/2022,G7a,15,15,15,,2025-11-15 15:21:35.284,2025-11-15 15:21:35.284,0,2022-08-18
69189a7fdeab5375d296bcc9,18/08/2022,G6c,988,988,88,LCC,2025-11-15 15:21:35.213,2025-11-15 15:21:35.213,0,2022-08-18
69189a7fdeab5375d296bcc6,18/08/2022,G6b,463,463,63,CCL,2025-11-15 15:21:35.142,2025-11-15 15:21:35.142,0,2022-08-18
69189a7fdeab5375d296bcd5,18/08/2022,G7d,60,60,60,,2025-11-15 15:21:35.498,2025-11-15 15:21:35.498,0,2022-08-18
69189a7edeab5375d296bcc0,18/08/2022,G5f,7036,036,36,CLC,2025-11-15 15:21:34.998,2025-11-15 15:21:34.998,0,2022-08-18
69189a7edeab5375d296bcbd,18/08/2022,G5e,5934,934,34,LLC,2025-11-15 15:21:34.927,2025-11-15 15:21:34.927,0,2022-08-18
69189a7edeab5375d296bcba,18/08/2022,G5d,4575,575,75,LLL,2025-11-15 15:21:34.856,2025-11-15 15:21:34.856,0,2022-08-18
69189a7edeab5375d296bcb7,18/08/2022,G5c,2714,714,14,LLC,2025-11-15 15:21:34.785,2025-11-15 15:21:34.785,0,2022-08-18
69189a7edeab5375d296bcb4,18/08/2022,G5b,8859,859,59,CLL,2025-11-15 15:21:34.713,2025-11-15 15:21:34.713,0,2022-08-18
69189a7fdeab5375d296bcc3,18/08/2022,G6a,570,570,70,LLC,2025-11-15 15:21:35.070,2025-11-15 15:21:35.070,0,2022-08-18
69189a7cdeab5375d296bc51,19/08/2022,G3f,13027,027,27,CCL,2025-11-15 15:21:32.339,2025-11-15 15:21:32.339,0,2022-08-19
69189a7cdeab5375d296bc4e,19/08/2022,G3e,90331,331,31,LLL,2025-11-15 15:21:32.268,2025-11-15 15:21:32.268,0,2022-08-19
69189a7cdeab5375d296bc4b,19/08/2022,G3d,74644,644,44,CCC,2025-11-15 15:21:32.197,2025-11-15 15:21:32.197,0,2022-08-19
69189a7cdeab5375d296bc48,19/08/2022,G3c,16217,217,17,CLL,2025-11-15 15:21:32.125,2025-11-15 15:21:32.125,0,2022-08-19
69189a7cdeab5375d296bc45,19/08/2022,G3b,51015,015,15,CLL,2025-11-15 15:21:32.050,2025-11-15 15:21:32.050,0,2022-08-19
69189a7bdeab5375d296bc3c,19/08/2022,G2a,49450,450,50,CLC,2025-11-15 15:21:31.835,2025-11-15 15:21:31.835,0,2022-08-19
69189a7bdeab5375d296bc3f,19/08/2022,G2b,24190,190,90,LLC,2025-11-15 15:21:31.906,2025-11-15 15:21:31.906,0,2022-08-19
69189a7bdeab5375d296bc39,19/08/2022,G1,52115,115,15,LLL,2025-11-15 15:21:31.764,2025-11-15 15:21:31.764,0,2022-08-19
69189a7bdeab5375d296bc36,19/08/2022,ĐB,75303,303,03,LCL,2025-11-15 15:21:31.693,2025-11-15 15:21:31.693,0,2022-08-19
69189a7cdeab5375d296bc54,19/08/2022,G4a,5832,832,32,CLC,2025-11-15 15:21:32.410,2025-11-15 15:21:32.410,0,2022-08-19
69189a7bdeab5375d296bc42,19/08/2022,G3a,39685,685,85,CCL,2025-11-15 15:21:31.979,2025-11-15 15:21:31.979,0,2022-08-19
69189a7cdeab5375d296bc57,19/08/2022,G4b,5220,220,20,CCC,2025-11-15 15:21:32.481,2025-11-15 15:21:32.481,0,2022-08-19
69189a7ddeab5375d296bc84,19/08/2022,G7d,75,75,75,,2025-11-15 15:21:33.553,2025-11-15 15:21:33.553,0,2022-08-19
69189a7cdeab5375d296bc5d,19/08/2022,G4d,6455,455,55,CLL,2025-11-15 15:21:32.624,2025-11-15 15:21:32.624,0,2022-08-19
69189a7cdeab5375d296bc5a,19/08/2022,G4c,1115,115,15,LLL,2025-11-15 15:21:32.554,2025-11-15 15:21:32.554,0,2022-08-19
69189a7ddeab5375d296bc7e,19/08/2022,G7b,96,96,96,,2025-11-15 15:21:33.411,2025-11-15 15:21:33.411,0,2022-08-19
69189a7ddeab5375d296bc7b,19/08/2022,G7a,08,08,08,,2025-11-15 15:21:33.339,2025-11-15 15:21:33.339,0,2022-08-19
69189a7ddeab5375d296bc78,19/08/2022,G6c,657,657,57,CLL,2025-11-15 15:21:33.268,2025-11-15 15:21:33.268,0,2022-08-19
69189a7ddeab5375d296bc75,19/08/2022,G6b,895,895,95,CLL,2025-11-15 15:21:33.197,2025-11-15 15:21:33.197,0,2022-08-19
69189a7ddeab5375d296bc72,19/08/2022,G6a,344,344,44,LCC,2025-11-15 15:21:33.126,2025-11-15 15:21:33.126,0,2022-08-19
69189a7ddeab5375d296bc81,19/08/2022,G7c,98,98,98,,2025-11-15 15:21:33.482,2025-11-15 15:21:33.482,0,2022-08-19
69189a7cdeab5375d296bc6c,19/08/2022,G5e,9861,861,61,CCL,2025-11-15 15:21:32.982,2025-11-15 15:21:32.982,0,2022-08-19
69189a7cdeab5375d296bc69,19/08/2022,G5d,5255,255,55,CLL,2025-11-15 15:21:32.910,2025-11-15 15:21:32.910,0,2022-08-19
69189a7cdeab5375d296bc66,19/08/2022,G5c,9192,192,92,LLC,2025-11-15 15:21:32.839,2025-11-15 15:21:32.839,0,2022-08-19
69189a7cdeab5375d296bc63,19/08/2022,G5b,7115,115,15,LLL,2025-11-15 15:21:32.767,2025-11-15 15:21:32.767,0,2022-08-19
69189a7cdeab5375d296bc60,19/08/2022,G5a,1424,424,24,CCC,2025-11-15 15:21:32.696,2025-11-15 15:21:32.696,0,2022-08-19
69189a7ddeab5375d296bc6f,19/08/2022,G5f,7330,330,30,LLC,2025-11-15 15:21:33.054,2025-11-15 15:21:33.054,0,2022-08-19
69189a7adeab5375d296bc00,20/08/2022,G3f,14503,503,03,LCL,2025-11-15 15:21:30.413,2025-11-15 15:21:30.413,0,2022-08-20
69189a7adeab5375d296bbfd,20/08/2022,G3e,82534,534,34,LLC,2025-11-15 15:21:30.342,2025-11-15 15:21:30.342,0,2022-08-20
69189a7adeab5375d296bbfa,20/08/2022,G3d,56575,575,75,LLL,2025-11-15 15:21:30.271,2025-11-15 15:21:30.271,0,2022-08-20
69189a7adeab5375d296bbf7,20/08/2022,G3c,42617,617,17,CLL,2025-11-15 15:21:30.200,2025-11-15 15:21:30.200,0,2022-08-20
69189a7adeab5375d296bbf4,20/08/2022,G3b,16424,424,24,CCC,2025-11-15 15:21:30.129,2025-11-15 15:21:30.129,0,2022-08-20
69189a79deab5375d296bbeb,20/08/2022,G2a,78650,650,50,CLC,2025-11-15 15:21:29.912,2025-11-15 15:21:29.912,0,2022-08-20
69189a79deab5375d296bbee,20/08/2022,G2b,66649,649,49,CCL,2025-11-15 15:21:29.984,2025-11-15 15:21:29.984,0,2022-08-20
69189a79deab5375d296bbe8,20/08/2022,G1,10226,226,26,CCC,2025-11-15 15:21:29.841,2025-11-15 15:21:29.841,0,2022-08-20
69189a79deab5375d296bbe5,20/08/2022,ĐB,10211,211,11,CLL,2025-11-15 15:21:29.770,2025-11-15 15:21:29.770,0,2022-08-20
69189a7adeab5375d296bc03,20/08/2022,G4a,8061,061,61,CCL,2025-11-15 15:21:30.485,2025-11-15 15:21:30.485,0,2022-08-20
69189a7adeab5375d296bbf1,20/08/2022,G3a,32250,250,50,CLC,2025-11-15 15:21:30.055,2025-11-15 15:21:30.055,0,2022-08-20
69189a7adeab5375d296bc06,20/08/2022,G4b,4557,557,57,LLL,2025-11-15 15:21:30.555,2025-11-15 15:21:30.555,0,2022-08-20
69189a7adeab5375d296bc09,20/08/2022,G4c,2846,846,46,CCC,2025-11-15 15:21:30.627,2025-11-15 15:21:30.627,0,2022-08-20
69189a7adeab5375d296bc0c,20/08/2022,G4d,6122,122,22,LCC,2025-11-15 15:21:30.698,2025-11-15 15:21:30.698,0,2022-08-20
69189a7bdeab5375d296bc33,20/08/2022,G7d,19,19,19,,2025-11-15 15:21:31.622,2025-11-15 15:21:31.622,0,2022-08-20
69189a7bdeab5375d296bc2d,20/08/2022,G7b,44,44,44,,2025-11-15 15:21:31.481,2025-11-15 15:21:31.481,0,2022-08-20
69189a7bdeab5375d296bc2a,20/08/2022,G7a,76,76,76,,2025-11-15 15:21:31.409,2025-11-15 15:21:31.409,0,2022-08-20
69189a7bdeab5375d296bc27,20/08/2022,G6c,120,120,20,LCC,2025-11-15 15:21:31.338,2025-11-15 15:21:31.338,0,2022-08-20
69189a7bdeab5375d296bc24,20/08/2022,G6b,364,364,64,LCC,2025-11-15 15:21:31.266,2025-11-15 15:21:31.266,0,2022-08-20
69189a7bdeab5375d296bc21,20/08/2022,G6a,048,048,48,CCC,2025-11-15 15:21:31.195,2025-11-15 15:21:31.195,0,2022-08-20
69189a7bdeab5375d296bc30,20/08/2022,G7c,31,31,31,,2025-11-15 15:21:31.551,2025-11-15 15:21:31.551,0,2022-08-20
69189a7bdeab5375d296bc1b,20/08/2022,G5e,9707,707,07,LCL,2025-11-15 15:21:31.053,2025-11-15 15:21:31.053,0,2022-08-20
69189a7adeab5375d296bc18,20/08/2022,G5d,9074,074,74,CLC,2025-11-15 15:21:30.982,2025-11-15 15:21:30.982,0,2022-08-20
69189a7adeab5375d296bc15,20/08/2022,G5c,7172,172,72,LLC,2025-11-15 15:21:30.910,2025-11-15 15:21:30.910,0,2022-08-20
69189a7adeab5375d296bc12,20/08/2022,G5b,6905,905,05,LCL,2025-11-15 15:21:30.839,2025-11-15 15:21:30.839,0,2022-08-20
69189a7adeab5375d296bc0f,20/08/2022,G5a,1622,622,22,CCC,2025-11-15 15:21:30.769,2025-11-15 15:21:30.769,0,2022-08-20
69189a7bdeab5375d296bc1e,20/08/2022,G5f,8435,435,35,CLL,2025-11-15 15:21:31.124,2025-11-15 15:21:31.124,0,2022-08-20
69189a78deab5375d296bbaf,21/08/2022,G3f,43232,232,32,CLC,2025-11-15 15:21:28.482,2025-11-15 15:21:28.482,0,2022-08-21
69189a78deab5375d296bbac,21/08/2022,G3e,19982,982,82,LCC,2025-11-15 15:21:28.409,2025-11-15 15:21:28.409,0,2022-08-21
69189a78deab5375d296bba9,21/08/2022,G3d,72222,222,22,CCC,2025-11-15 15:21:28.337,2025-11-15 15:21:28.337,0,2022-08-21
69189a78deab5375d296bba6,21/08/2022,G3c,36003,003,03,CCL,2025-11-15 15:21:28.267,2025-11-15 15:21:28.267,0,2022-08-21
69189a78deab5375d296bba3,21/08/2022,G3b,21014,014,14,CLC,2025-11-15 15:21:28.196,2025-11-15 15:21:28.196,0,2022-08-21
69189a77deab5375d296bb9a,21/08/2022,G2a,11630,630,30,CLC,2025-11-15 15:21:27.982,2025-11-15 15:21:27.982,0,2022-08-21
69189a78deab5375d296bb9d,21/08/2022,G2b,27394,394,94,LLC,2025-11-15 15:21:28.053,2025-11-15 15:21:28.053,0,2022-08-21
69189a77deab5375d296bb97,21/08/2022,G1,51526,526,26,LCC,2025-11-15 15:21:27.911,2025-11-15 15:21:27.911,0,2022-08-21
69189a77deab5375d296bb94,21/08/2022,ĐB,17965,965,65,LCL,2025-11-15 15:21:27.841,2025-11-15 15:21:27.841,0,2022-08-21
69189a78deab5375d296bbb2,21/08/2022,G4a,5056,056,56,CLC,2025-11-15 15:21:28.554,2025-11-15 15:21:28.554,0,2022-08-21
69189a78deab5375d296bba0,21/08/2022,G3a,89056,056,56,CLC,2025-11-15 15:21:28.125,2025-11-15 15:21:28.125,0,2022-08-21
69189a78deab5375d296bbb5,21/08/2022,G4b,5006,006,06,CCC,2025-11-15 15:21:28.626,2025-11-15 15:21:28.626,0,2022-08-21
69189a79deab5375d296bbe2,21/08/2022,G7d,66,66,66,,2025-11-15 15:21:29.699,2025-11-15 15:21:29.699,0,2022-08-21
69189a78deab5375d296bbbb,21/08/2022,G4d,2620,620,20,CCC,2025-11-15 15:21:28.767,2025-11-15 15:21:28.767,0,2022-08-21
69189a78deab5375d296bbb8,21/08/2022,G4c,6540,540,40,LCC,2025-11-15 15:21:28.696,2025-11-15 15:21:28.696,0,2022-08-21
69189a79deab5375d296bbdc,21/08/2022,G7b,28,28,28,,2025-11-15 15:21:29.557,2025-11-15 15:21:29.557,0,2022-08-21
69189a79deab5375d296bbd9,21/08/2022,G7a,57,57,57,,2025-11-15 15:21:29.486,2025-11-15 15:21:29.486,0,2022-08-21
69189a79deab5375d296bbd6,21/08/2022,G6c,503,503,03,LCL,2025-11-15 15:21:29.416,2025-11-15 15:21:29.416,0,2022-08-21
69189a79deab5375d296bbd3,21/08/2022,G6b,685,685,85,CCL,2025-11-15 15:21:29.344,2025-11-15 15:21:29.344,0,2022-08-21
69189a79deab5375d296bbd0,21/08/2022,G6a,649,649,49,CCL,2025-11-15 15:21:29.274,2025-11-15 15:21:29.274,0,2022-08-21
69189a79deab5375d296bbdf,21/08/2022,G7c,49,49,49,,2025-11-15 15:21:29.628,2025-11-15 15:21:29.628,0,2022-08-21
69189a79deab5375d296bbca,21/08/2022,G5e,5858,858,58,CLC,2025-11-15 15:21:29.130,2025-11-15 15:21:29.130,0,2022-08-21
69189a79deab5375d296bbc7,21/08/2022,G5d,4090,090,90,CLC,2025-11-15 15:21:29.058,2025-11-15 15:21:29.058,0,2022-08-21
69189a78deab5375d296bbc4,21/08/2022,G5c,8413,413,13,CLL,2025-11-15 15:21:28.982,2025-11-15 15:21:28.982,0,2022-08-21
69189a78deab5375d296bbc1,21/08/2022,G5b,4822,822,22,CCC,2025-11-15 15:21:28.910,2025-11-15 15:21:28.910,0,2022-08-21
69189a78deab5375d296bbbe,21/08/2022,G5a,8936,936,36,LLC,2025-11-15 15:21:28.839,2025-11-15 15:21:28.839,0,2022-08-21
69189a79deab5375d296bbcd,21/08/2022,G5f,3016,016,16,CLC,2025-11-15 15:21:29.202,2025-11-15 15:21:29.202,0,2022-08-21
69189a76deab5375d296bb5e,22/08/2022,G3f,72718,718,18,LLC,2025-11-15 15:21:26.558,2025-11-15 15:21:26.558,0,2022-08-22
69189a76deab5375d296bb5b,22/08/2022,G3e,35859,859,59,CLL,2025-11-15 15:21:26.487,2025-11-15 15:21:26.487,0,2022-08-22
69189a76deab5375d296bb58,22/08/2022,G3d,93800,800,00,CCC,2025-11-15 15:21:26.416,2025-11-15 15:21:26.416,0,2022-08-22
69189a76deab5375d296bb55,22/08/2022,G3c,00516,516,16,LLC,2025-11-15 15:21:26.344,2025-11-15 15:21:26.344,0,2022-08-22
69189a76deab5375d296bb52,22/08/2022,G3b,87817,817,17,CLL,2025-11-15 15:21:26.273,2025-11-15 15:21:26.273,0,2022-08-22
69189a76deab5375d296bb49,22/08/2022,G2a,38872,872,72,CLC,2025-11-15 15:21:26.058,2025-11-15 15:21:26.058,0,2022-08-22
69189a76deab5375d296bb4c,22/08/2022,G2b,08164,164,64,LCC,2025-11-15 15:21:26.130,2025-11-15 15:21:26.130,0,2022-08-22
69189a75deab5375d296bb46,22/08/2022,G1,61027,027,27,CCL,2025-11-15 15:21:25.986,2025-11-15 15:21:25.986,0,2022-08-22
69189a75deab5375d296bb43,22/08/2022,ĐB,60652,652,52,CLC,2025-11-15 15:21:25.915,2025-11-15 15:21:25.915,0,2022-08-22
69189a76deab5375d296bb61,22/08/2022,G4a,9816,816,16,CLC,2025-11-15 15:21:26.629,2025-11-15 15:21:26.629,0,2022-08-22
69189a76deab5375d296bb4f,22/08/2022,G3a,30974,974,74,LLC,2025-11-15 15:21:26.202,2025-11-15 15:21:26.202,0,2022-08-22
69189a76deab5375d296bb64,22/08/2022,G4b,5220,220,20,CCC,2025-11-15 15:21:26.699,2025-11-15 15:21:26.699,0,2022-08-22
69189a77deab5375d296bb91,22/08/2022,G7d,94,94,94,,2025-11-15 15:21:27.770,2025-11-15 15:21:27.770,0,2022-08-22
69189a76deab5375d296bb6a,22/08/2022,G4d,3029,029,29,CCL,2025-11-15 15:21:26.842,2025-11-15 15:21:26.842,0,2022-08-22
